"id","url","score","title","summary","venue","year","authors","citationCount","referenceCount","influentialCitationCount"
"a89e98dec113aebb4529fa4c4821a2acf93f78ec","https://www.semanticscholar.org/paper/a89e98dec113aebb4529fa4c4821a2acf93f78ec",2,"Accurate Stock Movement Prediction with Self-supervised Learning from Sparse Noisy Tweets","SLOT (Self-supervised Learning of Tweets for Capturing Multi-level Price Trends), an accurate method for stock movement prediction, which learns multi-level relationships between stocks from tweets, making it robust to the unreliability of tweets.","2022 IEEE International Conference on Big Data (Big Data)",2022,"Yejun Soun,Jaemin Yoo,Minyong Cho,Jihyeong Jeon,U. Kang",2,44,2
"3c2d2186db788b83b677921bf03586ce3d63cb59","https://www.semanticscholar.org/paper/3c2d2186db788b83b677921bf03586ce3d63cb59",2,"Improved Stock Price Movement Classification Using News Articles Based on Embeddings and Label Smoothing","This paper proposes to improve stock price movement prediction using news articles by incorporating regularization and optimization techniques from deep learning, and incorporates weight decay, batch normalization, dropout, and label smoothing to improve the generalization of the trained models.","arXiv.org",2023,"Luis Villamil,Ryan Bausback,Shaeke Salman,Ting Liu,Conrad Horn,Xiuwen Liu",0,29,0
"797b0cb3f0e401d699bbf7c4d1e192c17d85d3aa","https://www.semanticscholar.org/paper/797b0cb3f0e401d699bbf7c4d1e192c17d85d3aa",2,"Model-Agnostic Meta-Learning for Natural Language Understanding Tasks in Finance","The authors' models achieve the state-of-the-art performance according to the experimental results, which demonstrate that the MAML method can adapt fast and well to low-resource situations.","arXiv.org",2023,"Bixing Yan,Shaoling Chen,Yuxuan He,Zhihan Li",0,26,0
"864d94f0f70ecce3bb5ec6fa0d81d2da259fd4af","https://www.semanticscholar.org/paper/864d94f0f70ecce3bb5ec6fa0d81d2da259fd4af",2,"Logit-based stock prediction network","A logit-based stock prediction network LogNet is proposed, which uses the correctly predicted logits to measure the reliability of stock data, then calculate the confidence interval of the stockData, and use the credible data to make stock predictions.","Fifth International Conference on Computer Information Science and Artificial Intelligence",2023,"Ling Dong,Mei Hong,Maojun Huang,Xue Dong",0,10,0
"cc4981bd87af019baeb567e362a28e97f9a5f87c","https://www.semanticscholar.org/paper/cc4981bd87af019baeb567e362a28e97f9a5f87c",2,"Multi-stage Hybrid Attentive Networks for Knowledge-Driven Stock Movement Prediction","","International Conference on Neural Information Processing",2021,"Jiaying Gong,Hoda Eldardiry",0,21,0
"15322b1ed9e8c062b9077a2bc48cd965f8d41d72","https://www.semanticscholar.org/paper/15322b1ed9e8c062b9077a2bc48cd965f8d41d72",2,"Multimodal Multi-Speaker Merger & Acquisition Financial Modeling: A New Task, Dataset, and Neural Baselines","M3ANet is introduced, a baseline architecture that takes advantage of the multimodal multi-speaker input to forecast the financial risk associated with the M&A calls and is released to motivate future research on this challenging problem domain.","Annual Meeting of the Association for Computational Linguistics",2021,"Ramit Sawhney,Mihir Goyal,Prakhar Goel,Puneet Mathur,R. Shah",4,62,1
"f688445daff96a8aecca5ffad37c329597f55207","https://www.semanticscholar.org/paper/f688445daff96a8aecca5ffad37c329597f55207",2,"Incorporating Stock Market Signals for Twitter Stance Detection","A robust multi-task neural architecture that combines textual input with high-frequency intra-day time series from stock market prices is proposed, demonstrating that the combination of multiple input signals is effective for cross-target stance detection, and opens interesting research directions for future work.","Annual Meeting of the Association for Computational Linguistics",2022,"Costanza Conforti,Jakob Berndt,Mohammad Taher Pilehvar,Chryssi Giannitsarou,Flavio Toxvaerd,Nigel Collier",0,134,0
"1b3f4263120b12916bf9c656aa3c2a260203e33b","https://www.semanticscholar.org/paper/1b3f4263120b12916bf9c656aa3c2a260203e33b",2,"Meta-Adaptive Stock Movement Prediction with Two-Stage Representation Learning","Inspired by importance sampling probability for tasks to balance the domain dis- crepancy caused by evolving temporal domains, a novel framework for stock movement pre-7 diction based on self-supervised learning and meta-learning is presented.","",2022,"Donglin Zhan",2,47,0
"b849fd6dd24967bdb574fc5ec57acdfac768f4ab","https://www.semanticscholar.org/paper/b849fd6dd24967bdb574fc5ec57acdfac768f4ab",2,"Sentiment Analysis of Stocktwits Data With Word Vector and Gated Recurrent Unit","This study proposes to use Gated Recurrent Unit (GRU) for predicting the sentiment of tweets related to stockprice, and implements word vector, in particular word2vec, as features for GRU.","Jurnal Linguistik Komputasional (JLK)",2021,"Oscar .,H. Pardede",0,21,0
"7ae0c22870fd23366dd27ec977f56a819ea86f8e","https://www.semanticscholar.org/paper/7ae0c22870fd23366dd27ec977f56a819ea86f8e",2,"Selective transfer learning with adversarial training for stock movement prediction","The STLAT method advances existing solutions in two major aspects: (i) tailoring the pre-trained and fine-tuned method for stock movement prediction and (ii) introducing the data selector module to select the more relevant training samples from stocks in source domain.","Connection science",2022,"Yang Li,Hongning Dai,Zibin Zheng",5,57,1
"31c78bb85486ba8f1780b21e06be0f8f0f4dfaa0","https://www.semanticscholar.org/paper/31c78bb85486ba8f1780b21e06be0f8f0f4dfaa0",2,"A Word is Worth A Thousand Dollars: Adversarial Attack on Tweets Fools Stock Prediction","This paper addresses the task of adversarial generation by solving combinatorial optimization problems with semantics and budget constraints with consistent success rates and cause significant monetary loss in trading simulation by simply concatenating a perturbed but semantically similar tweet.","North American Chapter of the Association for Computational Linguistics",2022,"Yong Xie,Dakuo Wang,Pin-Yu Chen,Jinjun Xiong,Sijia Liu,O. Koyejo",6,55,0
"1872f215570377855739627afa78ed18ba8e4c5b","https://www.semanticscholar.org/paper/1872f215570377855739627afa78ed18ba8e4c5b",2,"Forecasting COVID-19 Caseloads Using Unsupervised Embedding Clusters of Social Media Posts","A novel approach incorporating transformer-based language models into infectious disease modelling by tracking high-density clusters of sentence-level representations of Reddit posts within specific US states’ COVID-19 subreddits shows that these clustered embedding features outperform all other feature types at predicting upward trend signals.","North American Chapter of the Association for Computational Linguistics",2022,"Felix Drinkall,S. Zohren,J. Pierrehumbert",2,46,0
"91382df81f9de79824712f2739f3821fe4b74239","https://www.semanticscholar.org/paper/91382df81f9de79824712f2739f3821fe4b74239",2,"MetaTrader: An Reinforcement Learning Approach Integrating Diverse Policies for Portfolio Optimization","MetaTrader is proposed, a novel two-stage RL-based approach for portfolio management, which learns to integrate diverse trading policies to adapt to various market conditions and significantly outperforms state-of-the-art baselines in balancing profits and risks.","International Conference on Information and Knowledge Management",2022,"Hui Niu,Siyuan Li,Jian Li",3,58,1
"5c98233ce81f825079e560fd8d1e7149bb690a44","https://www.semanticscholar.org/paper/5c98233ce81f825079e560fd8d1e7149bb690a44",2,"Multimodal Neural Network For Demand Forecasting","A multi-modal sales forecasting network that combines real-life events from news articles with traditional data such as historical sales and holiday information is proposed that fuse information from general product trends published by Google trends.","International Conference on Neural Information Processing",2022,"Nitesh Kumar,K. Dheenadayalan,Suprabath Reddy,Sumant Kulkarni",1,39,0
"9da952f877eecb2f0a369873f21eac2c90584680","https://www.semanticscholar.org/paper/9da952f877eecb2f0a369873f21eac2c90584680",2,"Stock Movement Prediction via Temporal Convolutional Network and Interactive Attention Network","A novel method to predict the stock movement based on Temporal Convolution Network (TCN) and Interactive Attention Network (IAN), in which TCN can effectively avoid using future information when obtaining the features of text and price.","2023 International Conference on Intelligent and Innovative Technologies in Computing, Electrical and Electronics (IITCEE)",2023,"Sing Guo,Hui Ai,Shanxin Li",0,25,0
"59b6472ccd087baa414acbbce315b21a8bb2662e","https://www.semanticscholar.org/paper/59b6472ccd087baa414acbbce315b21a8bb2662e",2,"Spatiotemporal Transformer for Stock Movement Prediction","","arXiv.org",2023,"Daniel Boyle,J. Kalita",0,35,0
"238efb9404f15e37f0d42ba1fd1eec0e5d9db36e","https://www.semanticscholar.org/paper/238efb9404f15e37f0d42ba1fd1eec0e5d9db36e",1,"Cryptoblend: An AI-Powered Tool for Aggregation and Summarization of Cryptocurrency News","Cutting-edge solutions in the field of natural language processing were employed to cluster news by topic and summarize the corresponding articles published by different newspapers, and the results show the effectiveness of the proposed methodology in most of the cases.","Informatics",2023,"A. Pozzi,Enrico Barbierato,Daniele Toti",2,12,0
"09808c3a79efccd3f6d3300b20ac2d1b3d6e494f","https://www.semanticscholar.org/paper/09808c3a79efccd3f6d3300b20ac2d1b3d6e494f",1,"What Do We Know About Meme Stocks? A Bibliometric and Systematic Review, Current Streams, Developments, and Directions for Future Research","","Social Science Research Network",2023,"Haitham Nobanee,Nejla Ould Daoud Ellili",2,57,0
"dab377f1220608cf1d15c0cc58e0ce8dfad8f68e","https://www.semanticscholar.org/paper/dab377f1220608cf1d15c0cc58e0ce8dfad8f68e",1,"Mutual coupling between stock market and cryptocurrencies","","Heliyon",2023,"M. Ahmed,Samuel Asumadu Sarkodie,T. Leirvik",0,53,0
"a96c0e4c21495a4b7e667ad6a14e3561f0ccc19c","https://www.semanticscholar.org/paper/a96c0e4c21495a4b7e667ad6a14e3561f0ccc19c",1,"Predicting Stock Price Movement Direction with Enterprise Knowledge Graph","This research proposes power vector model and influence propagation model to mine the rich information in constructed Enterprise Knowledge Graph (EKG) for price movement prediction and shows good prediction performance on the dataset of China top 500 enterprises.","Pacific Asia Conference on Information Systems",2018,"Yu-xin Zhang,Kunlin Yang,Wei Du,W. Xu",2,33,0
"5fa739bb5a06f9ef1f17a51959eb8b326560b99c","https://www.semanticscholar.org/paper/5fa739bb5a06f9ef1f17a51959eb8b326560b99c",1,"Ju n 20 18 Multivariable LSTM neural network for autoregressive exogenous model","This paper proposes a multi-variable LSTM capable of accurate forecasting and variable importance interpretation for time series with exogenous variables and exhibits the prospect of multi- variable L STM as an end-to-end framework for both forecasting and knowledge discovery.","",2018,"Tian Guo,Tao Lin",0,55,0
"54827c06228b557ef64f7a14dfc092a3b31e2cf9","https://www.semanticscholar.org/paper/54827c06228b557ef64f7a14dfc092a3b31e2cf9",1,"Stock market trend prediction with sentiment analysis based on LSTM neural network","This thesis aims to propose a method of feature selection for selecting useful stock indexes and proposes deep learning model to do sentiment analysis of financial news as another influencing factor influencing stock trend.","",2019,"X. Jiawei,T. Murata",10,10,1
"1d72b2214b6f59e985f787ec8b94be8afcdc4ee9","https://www.semanticscholar.org/paper/1d72b2214b6f59e985f787ec8b94be8afcdc4ee9",1,"Machine Learning Techniques for Annotations of Large Financial Text Datasets","This work seeks to investigate the use of machine learning techniques for annotations on UIMA a framework used for the analysis of unstructured data.","Americas Conference on Information Systems",2019,"Jesse Roberts,M. Volk,R. Neumann,K. Turowski",1,66,0
"31e8e983a2b20a7887179da4ea127a44cc3ed3b2","https://www.semanticscholar.org/paper/31e8e983a2b20a7887179da4ea127a44cc3ed3b2",1,"News-oriented Stock Price Trend Prediction","With the analysis of daily news’ impact on stock markets, some key features that could be useful in stock price prediction are identified and a deep learning model is proposed to capture the dynamics of stock price trend with rich news textual information.","",2019,"Zecheng Zhang,Xin He,Jiachen Ge",1,11,1
"964018a1d8839911e025041e017875fb85a9ca42","https://www.semanticscholar.org/paper/964018a1d8839911e025041e017875fb85a9ca42",1,"Augmented Textual Features-Based Stock Market Prediction","A comparison of the approach with other sentiment-based stock market prediction approaches including Deep learning, establishes that the proposed model is performing adequately and predicting stock movements with a higher accuracy than other approaches.","IEEE Access",2020,"S. Bouktif,A. Fiaz,M. Awad",25,48,0
"2f8023a8185670c777d0415e4404ad379479f78e","https://www.semanticscholar.org/paper/2f8023a8185670c777d0415e4404ad379479f78e",1,"Combining Hybrid Attention Networks and LSTM for Stock Trend Prediction","This research merge two different models of the Hybrid Attention Networks and the Long Short-Term Memory to improve the stock trend prediction and shows that the best accuracy score, combined with news and stock prices, is 80 %.","Taiwan Conference on Computational Linguistics and Speech Processing",2020,"Hsin-Wen Liu,Jenq-Haur Wang",0,11,0
"c859e19c02459d74f2999fcd1d080a5389e183f6","https://www.semanticscholar.org/paper/c859e19c02459d74f2999fcd1d080a5389e183f6",1,"AR-Stock: Deep Augmented Relational Stock Prediction","A novel framework of Deep Augmented Relational Stock Prediction ( AR-Stock), that predicts each company’s stock prices by leveraging its related corporations and introduces two novel self-supervised regularizers to inform the model with the global and local topol- ogy features.","",2021,"Tianxin Wei,Yuning You,Tianlong Chen",1,44,0
"6e60fd96f08c069b93eec431d286334c5fc6b1e6","https://www.semanticscholar.org/paper/6e60fd96f08c069b93eec431d286334c5fc6b1e6",1,"ALGA: Automatic Logic Gate Annotator for Building Financial News Events Detectors","It is shown that event detection classiﬁers trained on the data generated by the ALGA framework can achieve state-of-the-art performance in the domain-speciﬂc ﬁnancial events detection task.","Hawaii International Conference on System Sciences",2021,"Julija Bainiaksinaite,N. Kaplis,P. Treleaven",0,40,0
"153e060bc510ff63b7e6012d1b00395c53e692bc","https://www.semanticscholar.org/paper/153e060bc510ff63b7e6012d1b00395c53e692bc",1,"HIVE: Hierarchical Information Visualization for Explainability","An interactive tool is developed to demonstrate the ability and versatility of an explainable risk ranking model with a special focus on financial use cases and can benefit both academics and practitioners in finance as they can work around deep learning models with their newly gained insights.","International Joint Conference on Artificial Intelligence",2021,"Yi Juan,Yi-Shyuan Chiang,Shang-Chuan Liu,Ming-Feng Tsai,Chuan-Ju Wang",1,19,1
"d3998422bb81270bdfc2cf36a2f412b360765265","https://www.semanticscholar.org/paper/d3998422bb81270bdfc2cf36a2f412b360765265",1,"XRR: Explainable Risk Ranking for Financial Reports","The proposed eXplainable Risk Ranking model uses multilevel encoders and attention mechanisms to analyze financial risks among companies and enables to highlight the critical words and sentences within financial reports that are most likely to influence financial risk and thus boasts better model explainability.","ECML/PKDD",2021,"Ting-Wei Lin,Ruei-Yao Sun,Hsuan-Ling Chang,Chuan-Ju Wang,Ming-Feng Tsai",2,36,0
"55ff66f4dfd1e851d778a9c00f419fa486ab8758","https://www.semanticscholar.org/paper/55ff66f4dfd1e851d778a9c00f419fa486ab8758",1,"Stock Movement Prediction using Technical and Data","This work utilizes Tesla data with sentiment analysis performed on news titles pertaining to the company as well as technical data on its stock over a three year period in order to predict closing price movement.","",2021,"Dylan M. Crain",0,17,0
"bd6ef2a95442801d9978b7b3d4324d77dee94d60","https://www.semanticscholar.org/paper/bd6ef2a95442801d9978b7b3d4324d77dee94d60",1,"D EEP M ULTIPLE I NSTANCE L EARNING FOR F ORECASTING S TOCK T RENDS USING F INANCIAL N EWS","This paper develops a flexible and adaptive multi- instance learning model and evaluates its ability in directional movement forecast of Standard & Poor’s 500 index on financial news dataset and demonstrates that the proposed multi-instance-based framework gains outstanding results in terms of the accuracy of trend prediction.","",2022,"S. Yiu",0,51,0
"cbbd31fc457f6c9640fa54e51de31d7215ccaa05","https://www.semanticscholar.org/paper/cbbd31fc457f6c9640fa54e51de31d7215ccaa05",1,"M ULTIPLE I NSTANCE L EARNING N ETWORKS FOR S TOCK M OVEMENTS P REDICTION WITH F INANCIAL N EWS","This paper develops a flexible and adaptive multi- instance learning model and evaluates its ability in directional movement forecast of Standard & Poor’s 500 index on financial news dataset and demonstrates that the proposed multi-instance-based framework gains outstanding results in terms of the accuracy of trend prediction.","",2022,"Yiqi Deng,S. Yiu",0,53,0
"1157e27db62d1a306a15f9543cb2a8ddd51bd3f7","https://www.semanticscholar.org/paper/1157e27db62d1a306a15f9543cb2a8ddd51bd3f7",1,"Understanding the Association Between Cryptocurrency Price Predictive Performance and Input Features","The results of the experiment showed that cryptocurrency price predictive performance the best when open price, high price, low price, volume and price were combined except for rate of closing price fluctuation.","",2022,"Jaehyun Park,Yeong-Seok Seo",2,37,0
"cbc6773eb07a32a571db93fb45f7d2261afacee9","https://www.semanticscholar.org/paper/cbc6773eb07a32a571db93fb45f7d2261afacee9",1,"Guided Attention Multimodal Multitask Financial Forecasting with Inter-Company Relationships and Global and Local News","The proposed Guided Attention Multimodal Multitask Network (GAME) model addresses challenges by using novel attention modules to guide learning with global and local information from different modalities and dynamic inter-company relationship networks.","Annual Meeting of the Association for Computational Linguistics",2022,"Gary (Ming) Ang,Ee-Peng Lim",5,39,0
"325b7ed719ff35d33255b1948082f5a7c479770d","https://www.semanticscholar.org/paper/325b7ed719ff35d33255b1948082f5a7c479770d",1,"Threshold-based portfolio: the role of the threshold and its applications","It is found that the risk and return profile of the realized TBP represents a monotonically increasing frontier on the risk–return plane, where the equally weighted universe portfolio plays a role in the lower bound of TBPs.","Journal of Supercomputing",2017,"Sang Il Lee,S. Yoo",26,51,3
"72fece548bcc250c5afed9914354e093ce671a00","https://www.semanticscholar.org/paper/72fece548bcc250c5afed9914354e093ce671a00",1,"Analysing forward-looking statements in initial public offering prospectuses: a text analytics approach","The study finds that FLS features are more predictive for pre-IPo as compared to post-IPO valuation prediction, and proposes an analytical pipeline for identifying FLSs using machine learning techniques.","",2018,"Jie Tao,A. Deokar,Ashutosh Deshmukh",9,42,2
"ba8cdf6c9da6f7ba2f7a0ac5c0ad72ce9657c8c1","https://www.semanticscholar.org/paper/ba8cdf6c9da6f7ba2f7a0ac5c0ad72ce9657c8c1",1,"An interpretable LSTM neural network for autoregressive exogenous model","Variable importance in real datasets characterized by the variable attention is highly in line with that determined by statistical Granger causality test, which exhibits the prospect of multi-variable LSTM as a simple and uniform end-to-end framework for both forecasting and knowledge discovery.","International Conference on Learning Representations",2018,"Tian Guo,Tao Lin,Yao Lu",25,30,3
"654892e454d37aa64ed5f7428dc728a8075e8d31","https://www.semanticscholar.org/paper/654892e454d37aa64ed5f7428dc728a8075e8d31",1,"A Survey of Deep Learning: Platforms, Applications and Emerging Research Trends","A thorough investigation of deep learning in its applications and mechanisms is sought, as a categorical collection of state of the art in deep learning research, to provide a broad reference for those seeking a primer on deep learning and its various implementations, platforms, algorithms, and uses in a variety of smart-world systems.","IEEE Access",2018,"W. G. Hatcher,Wei Yu",351,156,11
"1ebf9a2a13f334ebb539ca39d007b1ce7c101b6a","https://www.semanticscholar.org/paper/1ebf9a2a13f334ebb539ca39d007b1ce7c101b6a",1,"Multi-variable LSTM neural network for autoregressive exogenous model","This paper proposes a multi-variable LSTM capable of accurate forecasting and variable importance interpretation for time series with exogenous variables and exhibits the prospect of multi- variable L STM as an end-to-end framework for both forecasting and knowledge discovery.","arXiv.org",2018,"Tian Guo,Tao Lin",15,57,1
"f3d6cfe36f8b4e63c65ba55b3f601c0559855913","https://www.semanticscholar.org/paper/f3d6cfe36f8b4e63c65ba55b3f601c0559855913",1,"Threshold-based portfolio: the role of the threshold and its applications","It is found that the risk and return profile of the realized TBP represents a monotonically increasing frontier on the risk–return plane, where the equally weighted universe portfolio plays a role in the lower bound of TBPs.","Journal of Supercomputing",2018,"Sang Il Lee,S. Yoo",0,45,0
"b278f34cde7fb0e94e271ecfa7b0a0ed84c4d866","https://www.semanticscholar.org/paper/b278f34cde7fb0e94e271ecfa7b0a0ed84c4d866",1,"Temporal Relational Ranking for Stock Prediction","A new deep learning solution, named Relational Stock Ranking (RSR), named Temporal Graph Convolution, which jointly models the temporal evolution and relation network of stocks and outperforms state-of-the-art stock prediction solutions.","ACM Trans. Inf. Syst.",2018,"Fuli Feng,Xiangnan He,Xiang Wang,Cheng Luo,Yiqun Liu,Tat-Seng Chua",209,56,48
"5ceece0f2bf89ff1467592a9b6eaa36109770660","https://www.semanticscholar.org/paper/5ceece0f2bf89ff1467592a9b6eaa36109770660",1,"Improving Stock Movement Prediction with Adversarial Training","A new machine learning solution for stock movement prediction, which aims to predict whether the price of a stock will be up or down in the near future, is added to simulate the stochasticity of continuous price variable, and train the model to work well under small yet intentional perturbations.","arXiv.org",2018,"Fuli Feng,Huimin Chen,Xiangnan He,Ji Ding,Maosong Sun,Tat-Seng Chua",4,35,0
"c702107a56163dfd27526b7034be7bf946b03a85","https://www.semanticscholar.org/paper/c702107a56163dfd27526b7034be7bf946b03a85",1,"Hierarchical Complementary Attention Network for Predicting Stock Price Movements with News","A hierarchical complementary attention network (HCAN) is proposed to capture valuable complementary information in news title and content for stock movement prediction and experimental results show that the proposed model outperforms the state-of-the-art techniques.","International Conference on Information and Knowledge Management",2018,"Qikai Liu,Xiang Cheng,Sen Su,Shuguang Zhu",40,14,4
"3126dd4d66590249156d2ba2c85912515b487dac","https://www.semanticscholar.org/paper/3126dd4d66590249156d2ba2c85912515b487dac",1,"The Profitablity Graph of Financing Companies in Indonesia","","Proceedings of the Proceedings of the 1st International Conference on Finance Economics and Business, ICOFEB 2018, 12-13 November 2018, Lhokseumawe, Aceh, Indonesia",2018,"A. Lubis,M. Ismail,Z. Tarigan,Tapi Anda Sari Lubis,I. Muda",0,9,0
"b25f6ff1c7382c6ef968c616844df5c283d1fbfb","https://www.semanticscholar.org/paper/b25f6ff1c7382c6ef968c616844df5c283d1fbfb",1,"I Understand What You Are Saying: Leveraging Deep Learning Techniques for Aspect Based Sentiment Analysis","This study investigates aspect based sentiment dynamics of online reviews by proposing a semi-supervised, deep learning facilitated analytical pipeline and presents a novel perspective to understanding the dynamics of aspect based sentiments by analyzing aspects based sentiment in time series.","Hawaii International Conference on System Sciences",2019,"Jie Tao,Lina Zhou,Conor Feeney",5,20,0
"90e1f4b766d0ad652e3cf08ccbd401aeff825aac","https://www.semanticscholar.org/paper/90e1f4b766d0ad652e3cf08ccbd401aeff825aac",1,"Sensing Social Media Signals for Cryptocurrency News","This work compares several machine learning models, such as linear extrapolation, linear and random forest autoregressive models, and a sequence-to-sequence neural network for predicting the number of article mentions on Twitter after its publication of cryptocurrency news.","The Web Conference",2019,"Johannes Beck,Roberta Huang,David Lindner,Tian Guo,C. Zhang,D. Helbing,Nino Antulov-Fantulin",13,21,0
"d520ac6248716819f0c6d0c03737d2e738135b1e","https://www.semanticscholar.org/paper/d520ac6248716819f0c6d0c03737d2e738135b1e",1,"Exploring Interpretable LSTM Neural Networks over Multi-Variable Data","The structure of LSTM recurrent neural networks to learn variable-wise hidden states is explored, with the aim to capture different dynamics in multi-variable time series and distinguish the contribution of variables to the prediction.","International Conference on Machine Learning",2019,"Tian Guo,Tao Lin,Nino Antulov-Fantulin",114,66,17
