"id","url","score","title","summary","venue","year","authors","citationCount","referenceCount","influentialCitationCount"
"d39f804200013aa897788e2935508480868fa80c","https://www.semanticscholar.org/paper/d39f804200013aa897788e2935508480868fa80c",3,"Modeling financial uncertainty with multivariate temporal entropy-based curriculums","This work proposes a novel multi-modal curriculum learning approach, FinCLASS, which evaluates stock affecting signals via entropy-based heuristics and measures their linguistic and price-based complexities in a time-aware, hierarchical fashion and shows how FinCLASS out-performs state-of-the-art across stock movement prediction, volatility regression, and proﬁt generation.","Conference on Uncertainty in Artificial Intelligence",2021,"Ramit Sawhney,Arnav Wadhwa,Ayush Mangal,V. Mittal,Shivam Agarwal,R. Shah",2,52,0
"9302b13c194a955371c56b977088859c5cc3aeef","https://www.semanticscholar.org/paper/9302b13c194a955371c56b977088859c5cc3aeef",3,"FAST: Financial News and Tweet Based Time Aware Network for Stock Trading","This work proposes a novel hierarchical, learning to rank approach that uses textual data to make time-aware predictions for ranking stocks based on expected profit and outperforms state-of-the-art methods by over 8% in terms of cumulative profit and risk-adjusted returns.","Conference of the European Chapter of the Association for Computational Linguistics",2021,"Ramit Sawhney,Arnav Wadhwa,Shivam Agarwal",17,70,3
"865f5a669df80a0782be9e681c3b12b637a32d0e","https://www.semanticscholar.org/paper/865f5a669df80a0782be9e681c3b12b637a32d0e",3,"Fundamental Analysis based Neural Network for Stock Movement Prediction","A fundamental analysis based neural network for stock movement prediction that introduces a coattention mechanism to capture the sufficient context information between text and prices across every day within a time window and obtains more sufficient stock representation.","China National Conference on Chinese Computational Linguistics",2022,"Zheng Yangjia,Li Xia,Mao Junteng,Chen Yuan",0,25,0
"f1bd7d7a0447af540e6491af72fc6dc9d00d45ff","https://www.semanticscholar.org/paper/f1bd7d7a0447af540e6491af72fc6dc9d00d45ff",3,"Hybrid Information Mixing Module for Stock Movement Prediction","A multilayer perceptron-based model, the hybrid information mixing module, is applied to the stock price movement prediction to conduct a price fluctuation prediction experiment in a stock market with high volatility.","IEEE Access",2023,"Jooweon Choi,Shiyong Yoo,Xiao Zhou,Youngbin Kim",1,52,0
"a180060b939bcb7d69d93253ad0b6265af205cf3","https://www.semanticscholar.org/paper/a180060b939bcb7d69d93253ad0b6265af205cf3",3,"Exploring the Scale-Free Nature of Stock Markets: Hyperbolic Graph Learning for Algorithmic Trading","HyperStockGAT is proposed, the first model on the Riemannian Manifolds for stock selection and significantly outperforms state-of-the-art stock forecasting methods in terms of profitability by over 12%, and risk-adjusted Sharpe Ratio by over 4%.","The Web Conference",2021,"Ramit Sawhney,Shivam Agarwal,Arnav Wadhwa,R. Shah",18,66,0
"dd810128f5423764d54c6196209d6af01b916143","https://www.semanticscholar.org/paper/dd810128f5423764d54c6196209d6af01b916143",3,"A hybrid approach for stock trend prediction based on tweets embedding and historical prices","A hybrid approach for stock market prediction based on tweets embedding and historical prices is proposed, which takes the internal semantic features and external structural characteristics of Twitter data into account, such that the generated tweet vectors can contain more effective information.","World wide web (Bussum)",2021,"Huihui Ni,Shuting Wang,Peng Cheng",13,40,0
"d456cb788ab3a17ed721ad09019de3012d548c92","https://www.semanticscholar.org/paper/d456cb788ab3a17ed721ad09019de3012d548c92",3,"Quantitative Day Trading from Natural Language using Reinforcement Learning","This work proposes a deep reinforcement learning approach that makes time-aware decisions to trade stocks while optimizing profit using textual data and outperforms state-of-the-art in terms of risk-adjusted returns in trading simulations on two benchmarks.","North American Chapter of the Association for Computational Linguistics",2021,"Ramit Sawhney,Arnav Wadhwa,Shivam Agarwal,R. Shah",6,77,1
"9089378c88d33c28e3b547f7ebb12b93b269acdf","https://www.semanticscholar.org/paper/9089378c88d33c28e3b547f7ebb12b93b269acdf",3,"Hyperbolic Online Time Stream Modeling","This work proposes the first Hierarchical Time-Aware Hyperbolic LSTM, which leverages the Riemannian manifold for encoding the scale-free nature of a sequence of text in a time-aware fashion, and demonstrates HTLSTM's applicability for modeling temporal sequences of online information.","Annual International ACM SIGIR Conference on Research and Development in Information Retrieval",2021,"Ramit Sawhney,Shivam Agarwal,Megh Thakkar,Arnav Wadhwa,R. Shah",3,27,0
"513d62375404d231183faab2ae815d699f86da3a","https://www.semanticscholar.org/paper/513d62375404d231183faab2ae815d699f86da3a",3,"Graph-Based Learning for Stock Movement Prediction with Textual and Relational Data","A new stock movement prediction framework is proposed: multigraph recurrent network for stock forecasting (MGRN), which allows combining the textual sentiment from financial news and multiple relational information extracted from other types of financial data.","The Journal of Financial Data Science",2021,"Qinkai Chen,C. Robert",5,41,0
"dbaf9ff32a00161d777f6f5cd50e4028d733bd0d","https://www.semanticscholar.org/paper/dbaf9ff32a00161d777f6f5cd50e4028d733bd0d",3,"Stock Movement Prediction Based on Bi-Typed Hybrid-Relational Market Knowledge Graph via Dual Attention Networks","DANSMP, a novel Dual Attention Networks to learn the momentum spillover signals based upon the constructed MKG for stock prediction is proposed and demonstrated that the proposed DANSMP is capable of improving stock prediction with the constructedMKG.","IEEE Transactions on Knowledge and Data Engineering",2022,"Yu Zhao,Huaming Du,Ying Liu,Shaopeng Wei,Xingyan Chen,Fuzhen Zhuang,Qing Li,Ji Liu,Gang Kou",9,62,0
"211c7f39bc37b45e53bf5b7cad7741069c75c928","https://www.semanticscholar.org/paper/211c7f39bc37b45e53bf5b7cad7741069c75c928",3,"Quantitative Stock Investment by Routing Uncertainty-Aware Trading Experts: A Multi-Task Learning Approach","AlphaMix is a novel two-stage mixture-of-experts (MoE) framework for quantitative investment to mimic the efficient bottom-up trading strategy design workflow of successful trading firms and is a universal framework that is applicable to various backbone network architectures with consistent performance gains.","arXiv.org",2022,"Shuo Sun,R. Wang,Bo An",2,52,0
"116e1f27fc21ef2e2a7d2f649d139dfb070f9277","https://www.semanticscholar.org/paper/116e1f27fc21ef2e2a7d2f649d139dfb070f9277",3,"Heterogeneous Interactive Snapshot Network for Review-Enhanced Stock Profiling and Recommendation","This paper proposes a novel heterogeneous interactive snapshot network for stock profiling and recommendation, and introduces a novel twins-GRU method, which tightly couples the media and price parallel sequences in a cross-interactive fashion to catch dynamic dependencies between successive snapshots.","International Joint Conference on Artificial Intelligence",2022,"Heyuan Wang,Tengjiao Wang,Shun Li,Shijie Guan,Jiayi Zheng,Wei Chen",1,34,0
"dd4a3b4ec42de0a46d16a49a4375723996f5f6fd","https://www.semanticscholar.org/paper/dd4a3b4ec42de0a46d16a49a4375723996f5f6fd",3,"Stock Market Prediction via Deep Learning Techniques: A Survey","This poster presents a probabilistic procedure to identify the neurons in the brain that secrete During the Yangtze River blackout, a process known as “red-plating”.","",2022,"Jinan Zou,Qi Zhao,Yang Jiao,Hai Cao,Yanxi Liu,Qingsen Yan,Ehsan Abbasnejad,Lingqiao Liu,Javen Qinfeng Shi",0,162,0
"13e4e72303a630c4b7e581d59facfc014c846a24","https://www.semanticscholar.org/paper/13e4e72303a630c4b7e581d59facfc014c846a24",3,"StockEmotions: Discover Investor Emotions for Financial Sentiment Analysis and Multivariate Time Series","This paper introduces StockEmotions, a new dataset for detecting emotions in the stock market that consists of 10,000 English comments collected from StockTwits, a financial social media platform, Inspired by behavioral finance.","arXiv.org",2023,"Jean Lee,Hoyoul Luis Youn,Josiah Poon,S. Han",0,43,0
"1d88b554dadf7a70dde8e5bbfe72393784a29ffb","https://www.semanticscholar.org/paper/1d88b554dadf7a70dde8e5bbfe72393784a29ffb",2,"aiai at the NTCIR-14 FinNum Task : Financial Numeral Tweets Fine-Grained Classification Using Deep Word and Character Embedding-Based Attention Model","The deep word and character embedding-based attention model is proposed to fine-grained classify the financial numeral tweets and has good performance.","",,"Ke Tian,Z. Peng",2,12,1
"597433c2e461c62ef5d44e7604071f067a4f114e","https://www.semanticscholar.org/paper/597433c2e461c62ef5d44e7604071f067a4f114e",2,"Investigating the Impact of Public Mood in the Stock Market","The overall purpose of this thesis is to study the correlation between scattered public mood and financial markets, and presents a solution to three classical problems of applied finance: the portfolio allocation problem, the formalization of market views and the use of mixed methods for stock returns prediction.","",2018,"Lorenzo Malandri,Frank Xing,C. Orsenigo,C. Vercellis,E. Cambria",0,23,0
"cf1ea6b89b89562a7a828e7938e2de7c9fc07288","https://www.semanticscholar.org/paper/cf1ea6b89b89562a7a828e7938e2de7c9fc07288",2,"Transformer-Based Capsule Network For Stock Movement Prediction","A CapTE (Capsule network based on Transformer Encoder) model which uses the Trans transformer Encoder to extract the deep semantic features of the social media and then captures the structural relationship of the texts through a capsule network is proposed.","",2019,"Jintao Liu,Hongfei Lin,Xikai Liu,Bo Xu,Yuqi Ren,Yufeng Diao,Liang Yang",33,33,3
"1e3521931133411a7b5ab0da903be1649ce6e3cb","https://www.semanticscholar.org/paper/1e3521931133411a7b5ab0da903be1649ce6e3cb",2,"EMNLP-IJCNLP 2019 ECONLP — Economics and Natural Language Processing Proceedings of the Second Workshop on Economics and Natural Language Processing (ECONLP 2019)","","",2019,"Ana Maria Oliveira",0,100,0
"20b5874e542152eb5ebf95549bc2660a1a062444","https://www.semanticscholar.org/paper/20b5874e542152eb5ebf95549bc2660a1a062444",2,"Stock Trend Prediction using Financial Market News and BERT","This paper applies the popular BERT model to leverage financial market news to predict stock price movements and shows that the proposed methods are simple but very effective, which can significantly improve the stock prediction accuracy on a standard financial database over the baseline system and existing work.","International Conference on Knowledge Discovery and Information Retrieval",2020,"Feng Wei,U. T. Nguyen",4,27,0
"9eceec79a2e57f181a156412aa92349acd0ef367","https://www.semanticscholar.org/paper/9eceec79a2e57f181a156412aa92349acd0ef367",2,"Machine Learning for Financial Risk Management: A Survey","A taxonomy of financial-risk-management tasks and connect them with relevant machine learning methods is presented, and major challenges being faced by researchers in this area are identified.","IEEE Access",2020,"Akib Mashrur,Wei Luo,Nayyar Zaidi,A. Robles-Kelly",22,234,0
"39b340e90509ef867a9be3e5770be9bcbd89af86","https://www.semanticscholar.org/paper/39b340e90509ef867a9be3e5770be9bcbd89af86",2,"FinTech Applications","","From Opinion Mining to Financial Argument Mining",2021,"Chung-Chi Chen,Hen-Hsen Huang,Hsin-Hsi Chen",1,42,0
"774e275b09b294599cbb3103818ebe7155d9582d","https://www.semanticscholar.org/paper/774e275b09b294599cbb3103818ebe7155d9582d",2,"Text-based Stock Market Analysis: A Review","The aim of this study is to survey the main stock market analysis models, text representation techniques for financial market prediction, shortcomings of existing techniques, and propose promising directions for future research.","",2021,"Kamaladdin Fataliyev,A. Chivukula,M. Prasad,An Liu",0,173,0
"8682cc9e5a84fcc4d6b19d9fe85a09da18ca8bf8","https://www.semanticscholar.org/paper/8682cc9e5a84fcc4d6b19d9fe85a09da18ca8bf8",2,"Improving the Prediction of Cryptocurrencies Movement Using Adversarial Training","","",2021,"Milad Mohammad Alemansour,M. Rastgarpour",0,25,0
"57cc9670e51ed0c0f9a8a4496fd44a18d5e779d3","https://www.semanticscholar.org/paper/57cc9670e51ed0c0f9a8a4496fd44a18d5e779d3",2,"Dynamic Graph Transformer for Implicit Tag Recognition","This work presents a novel dynamic graph transformer that distills the textual information and the entity relations on the fly and confirms the effectiveness of the approach to implicit tag recognition.","Conference of the European Chapter of the Association for Computational Linguistics",2021,"Yi-Ting Liou,Chung-Chi Chen,Hen-Hsen Huang,Hsin-Hsi Chen",3,26,0
"c8e9b670cd6dfaa7e7e5f5fcce79fb0630100051","https://www.semanticscholar.org/paper/c8e9b670cd6dfaa7e7e5f5fcce79fb0630100051",2,"One Step Ahead: A Framework for Detecting Unexpected Incidents and Predicting the Stock Markets","A framework that extracts incident facts globally based on a deep neural network, feeds them into models built on a global event database complemented with novel socioeconomic datasets, and predicts stock market directions in a simulated real-world setting with interpretable results that outperform various baselines is built.","IEEE Access",2021,"Ziyue Li,Shiwei Lyu,Haipeng Zhang,Tianpei Jiang",0,48,0
"3e604d007c72c212e5458dbff65c3b65561adb48","https://www.semanticscholar.org/paper/3e604d007c72c212e5458dbff65c3b65561adb48",2,"Research on stock prediction algorithm based on CNN and LSTM","The proposed model uses the convolution idea of CNN to construct feature extraction layer to extract features, and inputs the extracted features into LSTM, to study the temporal message of the features better and is effective in reducing forecasting errors.","Academic Journal of Computing &amp; Information Science",2022,"Keren He,Qian Jiang",0,21,0
"8bd96cf97fdd56eb0c73d91c4a0c03f90eb42896","https://www.semanticscholar.org/paper/8bd96cf97fdd56eb0c73d91c4a0c03f90eb42896",2,"GCNET: A novel graph-based approach for prediction of stock price movement","GCNET is a general prediction framework that can be applied for the prediction of the price ﬂuctuations of interacting stocks based on their historical data and uses a set of history-based prediction models to infer plausible initial labels for a subset of the stock nodes in the graph.","",2022,"Alireza Jafari,Saman Haratizadeh",0,40,0
"d828b6966fd455291c4471444be4099c308b96bf","https://www.semanticscholar.org/paper/d828b6966fd455291c4471444be4099c308b96bf",2,"DeepScalper: A Risk-Aware Deep Reinforcement Learning Framework for Intraday Trading with Micro-level Market Embedding","DeepScalper is proposed, a deep reinforcement learning framework for intraday trading that adopts an encoder-decoder architecture to learn robust market embedding incorporating both macro-level and micro-level market information and proposes a risk-aware auxiliary task by predicting future volatility.","arXiv.org",2022,"Shuo Sun,Rundong Wang,Xu He,Junlei Zhu,Jian Li,Bo An",2,27,0
"62fbd22c74502f49a90027ddb7640ddb43afe4ec","https://www.semanticscholar.org/paper/62fbd22c74502f49a90027ddb7640ddb43afe4ec",2,"HYPHEN: Hyperbolic Hawkes Attention For Text Streams","A Hyperbolic Hawkes Attention Network (HYPHEN), which learns a data-driven hyperbolic space and models irregular powerlaw excitations using a hyperbolics Hawkes process, and its practical applicability for modeling online text sequences in a geometry agnostic manner is demonstrated.","Annual Meeting of the Association for Computational Linguistics",2022,"Shivam Agarwal,Ramit Sawhney,S. Ahuja,R. Soun,S. Chava",0,45,0
"259252c0b67c814aac883db86aca4a49e61fdc4c","https://www.semanticscholar.org/paper/259252c0b67c814aac883db86aca4a49e61fdc4c",2,"Causality-Guided Multi-Memory Interaction Network for Multivariate Stock Price Movement Prediction","The proposed Causality-guided Multi-memory Interaction Network (CMIN), a novel end-to-end deep neural network for stock movement prediction which, for the first time, models the multi-modality between financial text data and causality-enhanced stock correlations to achieve higher prediction accuracy.","Annual Meeting of the Association for Computational Linguistics",2023,"Di Luo,Weiheng Liao,Shuqi Li,Xin Cheng,Rui Yan",0,31,0
"5b19ff1b60a042717566e2efe0854a39abfb26f8","https://www.semanticscholar.org/paper/5b19ff1b60a042717566e2efe0854a39abfb26f8",2,"Predicting short-term Bitcoin price fluctuations from buy and sell orders","A generative temporal mixture model of the volatility and trade order book data is constructed, which is able to out-perform the current state-of-the-art machine learning and time-series statistical models.","arXiv.org",2018,"Tian Guo,Nino Antulov-Fantulin",34,62,0
"2a8827288e0d7c5c5eec47a4951351863b5dff85","https://www.semanticscholar.org/paper/2a8827288e0d7c5c5eec47a4951351863b5dff85",2,"Bitcoin Volatility Forecasting with a Glimpse into Buy and Sell Orders","This paper proposes temporal mixture models capable of adaptively exploiting both volatility history and order book features, and demonstrates the prospect of the temporal mixture model as an interpretable forecasting framework over heterogeneous Bitcoin data.","Industrial Conference on Data Mining",2018,"Tian Guo,A. Bifet,Nino Antulov-Fantulin",39,70,0
"c7c6fb0c58e4aa43e035286521373384c40aea59","https://www.semanticscholar.org/paper/c7c6fb0c58e4aa43e035286521373384c40aea59",2,"Enhancing Stock Movement Prediction with Adversarial Training","A new machine learning solution for stock movement prediction, which aims to predict whether the price of a stock will be up or down in the near future, is added to simulate the stochasticity of price variable, and train the model to work well under small yet intentional perturbations.","International Joint Conference on Artificial Intelligence",2018,"Fuli Feng,Huimin Chen,Xiangnan He,Ji Ding,Maosong Sun,Tat-Seng Chua",133,43,25
"6085664ce565744d3cc92c0c79443559be371ece","https://www.semanticscholar.org/paper/6085664ce565744d3cc92c0c79443559be371ece",2,"Ensemble of Technical Analysis and Machine Learning for Market Trend Prediction","A new approach that leverages technical analysis to predict market directional movements is proposed, which aims to predict the directional movement of the NASDAQ’s most capitalized stocks by solving a classification problem.","IEEE Symposium Series on Computational Intelligence",2018,"Andrea Picasso Ratto,Simone Merello,L. Oneto,Yukun Ma,Lorenzo Malandri,E. Cambria",18,27,0
"1c2d5a3499f4c28554176fb7bdf2d889477240a5","https://www.semanticscholar.org/paper/1c2d5a3499f4c28554176fb7bdf2d889477240a5",2,"Investigating Timing and Impact of News on the Stock Market","Results on US market show that the information contained in news can be used as an accurate predictor for past price movements, when the future is considered, however, the correlation between news and stock market becomes less clear.","2018 IEEE International Conference on Data Mining Workshops (ICDMW)",2018,"Simone Merello,Andrea Picasso Ratto,Yukun Ma,L. Oneto,E. Cambria",14,27,2
"f942148c0f18f07927a6ecf61f2240e4e5fbbbc0","https://www.semanticscholar.org/paper/f942148c0f18f07927a6ecf61f2240e4e5fbbbc0",2,"Knowledge-Driven Stock Trend Prediction and Explanation via Temporal Convolutional Network","A novel Knowledge-Driven Temporal Convolutional Network is proposed for stock trend prediction and explanation that can react to abrupt changes much faster and outperform state-of-the-art methods on stock datasets, as well as facilitate the explanation of prediction particularly with abrupt changes.","The Web Conference",2019,"Shumin Deng,Ningyu Zhang,Wen Zhang,Jiaoyan Chen,Jeff Z. Pan,Huajun Chen",88,46,7
"9d3cdbd23950ea8bb08b0e8d88f34e2c11fb1741","https://www.semanticscholar.org/paper/9d3cdbd23950ea8bb08b0e8d88f34e2c11fb1741",2,"Ensemble Application of Transfer Learning and Sample Weighting for Stock Market Prediction","Results on a real simulation of trading show how the problem of stock market forecasting is formulated as regression of market returns can be used to invest in high performing stocks and achieve higher profits with less trades.","IEEE International Joint Conference on Neural Network",2019,"Simone Merello,Andrea Picasso Ratto,L. Oneto,E. Cambria",9,35,1
"cf039163bc505e615ff77f12454b26c48195898a","https://www.semanticscholar.org/paper/cf039163bc505e615ff77f12454b26c48195898a",2,"AlphaStock: A Buying-Winners-and-Selling-Losers Investment Strategy using Interpretable Deep Reinforcement Attention Networks","It turns out that AlphaStock tends to select the stocks as winners with high long-term growth, low volatility, high intrinsic value, and being undervalued recently.","Knowledge Discovery and Data Mining",2019,"Jingyuan Wang,Yang Zhang,Ke Tang,Junjie Wu,Zhang Xiong",68,29,8
"fc914d1f535c131064edea14c7e2aadbd36a88c9","https://www.semanticscholar.org/paper/fc914d1f535c131064edea14c7e2aadbd36a88c9",2,"Group, Extract and Aggregate: Summarizing a Large Amount of Finance News for Forex Movement Prediction","This work proposes a BERT-based Hierarchical Aggregation Model to summarize a large amount of finance news to predict forex movement and shows that the category based method performs best among three grouping methods and outperforms all the baselines.","Conference on Empirical Methods in Natural Language Processing",2019,"Deli Chen,Shuming Ma,Keiko Harimoto,Ruihan Bao,Qi Su,Xu Sun",11,33,2
"79d0551b3d121067097c6b43f2b267f395b164e7","https://www.semanticscholar.org/paper/79d0551b3d121067097c6b43f2b267f395b164e7",2,"Incorporating Fine-grained Events in Stock Movement Prediction","This work proposes a professional finance event dictionary built by domain experts and uses it to extract fine-grained events automatically from finance news, and designs a neural model to combine finance news with fine- grained event structure and stock trade data to predict the stock movement.","Conference on Empirical Methods in Natural Language Processing",2019,"Deli Chen,Yanyan Zou,Keiko Harimoto,Ruihan Bao,Xuancheng Ren,Xu Sun",20,30,3
"9283270eb03798819ba1f01ab3c761827a3d4f03","https://www.semanticscholar.org/paper/9283270eb03798819ba1f01ab3c761827a3d4f03",2,"A Divide-and-Conquer Framework for Attention-based Combination of Multiple Investment Strategies","A 2D-attention framework to capture the dynamics of the above two factors, which categorizes the whole market periods into a few stable states and jointly learn respective models for each state and build a state-wise attention model to combine them dynamically for the final task.","IEEE Global Conference on Signal and Information Processing",2019,"Xiao Yang,Weiqing Liu,Lewen Wang,Cheng Qu,Jiang Bian",2,27,0
"53e6efb480e7798db4ffe2022fc7166209f5f768","https://www.semanticscholar.org/paper/53e6efb480e7798db4ffe2022fc7166209f5f768",2,"Learning to Fuse Multiple Semantic Aspects from Rich Texts for Stock Price Prediction","Experimental results on real data sets show the superior performance of MAFN against several strong baselines as well as the effectiveness of exploiting and fusing fine-grained aspect-level textual information for stock price prediction.","WISE",2019,"Ning Tang,Yanyan Shen,Junjie Yao",7,24,1
"b10aed06fa893a1af4b3206ea42ea3e5a20445fe","https://www.semanticscholar.org/paper/b10aed06fa893a1af4b3206ea42ea3e5a20445fe",2,"Technical analysis and sentiment embeddings for market trend prediction","This work aims to combine both technical and fundamental analysis through the application of data science and machine learning techniques and produces a robust predictive model able to forecast the trend of a portfolio composed by the twenty most capitalized companies listed in the NASDAQ100 index.","Expert systems with applications",2019,"Andrea Picasso Ratto,Simone Merello,Yukun Ma,L. Oneto,E. Cambria",157,63,4
"00c7a21bd4d7c2c67ae54efbd2f6336cd5dc17e6","https://www.semanticscholar.org/paper/00c7a21bd4d7c2c67ae54efbd2f6336cd5dc17e6",2,"Applications of deep learning in stock market prediction: recent progress","A review of recent works on deep learning models for stock market prediction by category the different data sources, various neural network structures, and common used evaluation metrics to help the interested researchers to synchronize with the latest progress and also help them to easily reproduce the previous studies as baselines.","Expert systems with applications",2020,"Weiwei Jiang",210,213,9
"a5ae9f992264908e51c7925280f42ee17a500858","https://www.semanticscholar.org/paper/a5ae9f992264908e51c7925280f42ee17a500858",2,"NLP in FinTech Applications: Past, Present and Future","This position paper focuses on the researches applying natural language processing (NLP) technologies in the finance domain and outlines the application scenarios from three aspects including Know Your Customer (KYC), Know Your Product (KYP), and Satisfy Your customer (SYC).","arXiv.org",2020,"Chung-Chi Chen,Hen-Hsen Huang,Hsin-Hsi Chen",10,62,1
"3d9a08afe6c34db82d83d6927d2cbd8de4be44e0","https://www.semanticscholar.org/paper/3d9a08afe6c34db82d83d6927d2cbd8de4be44e0",2,"Fine-grained Financial Opinion Mining: A Survey and Research Agenda","A road map of fine-grained financial opinion mining is proposed for future researches, and several challenges yet to explore are pointed out.","arXiv.org",2020,"Chung-Chi Chen,Hen-Hsen Huang,Hsin-Hsi Chen",2,57,0
