"id","url","score","title","summary","venue","year","authors","citationCount","referenceCount","influentialCitationCount"
"0502ec1c19dc1d75ae6cc30c790038e3cbc2b3dc","https://www.semanticscholar.org/paper/0502ec1c19dc1d75ae6cc30c790038e3cbc2b3dc",2,"Multi-Graph Convolutional Network for Relationship-Driven Stock Movement Prediction","A deep learning framework, called Multi-GCGRU, which comprises graph convolutional network (GCN) and gated recurrent unit (GRU) to predict stock movement, which is feasible to incorporate more effective stock relationships containing expert knowledge, as well as learn data-driven relationship.","International Conference on Pattern Recognition",2020,"Jiexia Ye,Juanjuan Zhao,Kejiang Ye,Chengzhong Xu",20,48,3
"e78bf1007470d1dc78cab1b37073fb5ee4260387","https://www.semanticscholar.org/paper/e78bf1007470d1dc78cab1b37073fb5ee4260387",2,"ND-SMPF: A Noisy Deep Neural Network Fusion Framework for Stock Price Movement Prediction","The proposed ND-SMPF predictive framework uses information fusion to combine twitter data with extended horizon market historical prices to boost the accuracy of the stock movement prediction task.","Fusion",2020,"Farnoush Ronaghi,Mohammad Salimibeni,F. Naderkhani,Arash Mohammadi",4,38,0
"b741167bb65d7d25529345fac989bebd87c46c5b","https://www.semanticscholar.org/paper/b741167bb65d7d25529345fac989bebd87c46c5b",2,"Modeling the Stock Relation with Graph Network for Overnight Stock Movement Prediction","A LSTM Relational Graph Convolutional Network model, which models the connection among stocks with their correlation matrix, which outperforms the baseline models and enables the movement of stocks that are not directly associated with news as well as the whole market, which is not available in most previous methods.","International Joint Conference on Artificial Intelligence",2020,"Wei Li,Ruihan Bao,Keiko Harimoto,Deli Chen,Jingjing Xu,Qi Su",78,26,9
"465b79c0e2ce7d25bdf456ac5ea393fef33f1862","https://www.semanticscholar.org/paper/465b79c0e2ce7d25bdf456ac5ea393fef33f1862",2,"Stock Embeddings Acquired from News Articles and Price History, and an Application to Portfolio Optimization","The results of portfolio optimization using Reuters & Bloomberg headlines, producing a capital gain 2.8 times larger than that obtained with a baseline method using only stock price data suggests that the proposed stock embedding can leverage textual financial semantics to solve financial prediction problems.","Annual Meeting of the Association for Computational Linguistics",2020,"Xin Du,Kumiko Tanaka-Ishii",33,31,7
"68fbb64848798cef0bc2a38f0245c365132fb9f1","https://www.semanticscholar.org/paper/68fbb64848798cef0bc2a38f0245c365132fb9f1",2,"Stock Index Prediction with Multi-task Learning and Word Polarity Over Time","A two-stage system that consists of a sentiment extractor to extract the opinion on the market trend and a summarizer that predicts the direction of the index movement of following week given the opinions of the news over the current week is proposed.","arXiv.org",2020,"Yue Zhou,K. Voigt",1,23,0
"f9a84f04c0221bdf44a94bb26c023d11187fd9cc","https://www.semanticscholar.org/paper/f9a84f04c0221bdf44a94bb26c023d11187fd9cc",2,"Towards Earnings Call and Stock Price Movement","This work proposes to model the language in transcripts using a deep learning framework, where an attention mechanism is applied to encode the text data into vectors for the discriminative network classifier to predict stock price movements.","arXiv.org",2020,"Zhiqiang Ma,G. Bang,Chong Wang,Xiaomo Liu",4,26,1
"f824314249839d19f6265844e5df739e7b3e5cbd","https://www.semanticscholar.org/paper/f824314249839d19f6265844e5df739e7b3e5cbd",2,"Multimodal Multi-Task Financial Risk Forecasting","This work presents a multi-task solution that utilizes domain specialized textual features and audio attentive alignment for predictive financial risk and price modeling and shows the effectiveness of the deep multimodal approach.","ACM Multimedia",2020,"Ramit Sawhney,Puneet Mathur,Ayush Mangal,Piyush Khanna,R. Shah,Roger Zimmermann",22,122,3
"33cbe969241ba3808d3cab4f4fd574a9dc50bfaf","https://www.semanticscholar.org/paper/33cbe969241ba3808d3cab4f4fd574a9dc50bfaf",2,"Connecting the dots: forecasting and explaining short-term market volatility","This work proposes news-powered neural models to forecast short-term volatility and presents a soft-constrained dynamic beam allocation algorithm to control the state-of-the-art language model (GPT-2) to generate fluent and informative explanations.","International Conference on AI in Finance",2020,"Jie Yuan,Zhu Zhang",0,21,0
"50de2604072c04d6e5f2ae4e2865b434ca00a541","https://www.semanticscholar.org/paper/50de2604072c04d6e5f2ae4e2865b434ca00a541",2,"Utilization of deep learning to mine insights from earning calls for stock price movement predictions","This work uses earning call transcripts combined with companies' historical stock data and sector information to predict company's stock price movements and proposes a deep learning framework jointly, where attention mechanism is applied to the earnings call textual feature and a recurrent neural network is used on the sequential stock price data.","International Conference on AI in Finance",2020,"Zhiqiang Ma,Chong Wang,G. Bang,Xiaomo Liu",0,58,0
"e79ef3b3955d59ec94ce2317c2a612e399b563f6","https://www.semanticscholar.org/paper/e79ef3b3955d59ec94ce2317c2a612e399b563f6",2,"Market volatility prediction based on long- and short-term memory retrieval architectures","A new deep neural network-based architecture named Long- and Short-term Memory Retrieval (LSMR) architecture to forecast short-term and mid-term volatility and demonstrates the superior performance of the proposed models in predicting highly volatile scenarios, compared to existing methods in the literature.","International Conference on AI in Finance",2020,"Jie Yuan,Zhu Zhang",0,20,0
"6c996c6271f06d16f0d89a807070e4d8e35a201f","https://www.semanticscholar.org/paper/6c996c6271f06d16f0d89a807070e4d8e35a201f",2,"Spatiotemporal Hypergraph Convolution Network for Stock Movement Forecasting","STHGCN significantly outperforms state-of-the-art stock forecasting methods over extensive experiments on long term realworld S&P500 index data of stocks traded in the NASDAQ and NYSE markets over 12 diverse phases and proposes a novel architecture for stock trend forecasting that can be applied across various problems in the spatiotemporal domain.","Industrial Conference on Data Mining",2020,"Ramit Sawhney,Shivam Agarwal,Arnav Wadhwa,R. Shah",21,61,3
"3bdd56928c8d32b956239296666caee31c50395f","https://www.semanticscholar.org/paper/3bdd56928c8d32b956239296666caee31c50395f",2,"Enhancing Stock Trend Prediction Models by Mining Relational Graphs of Stock Prices","The proposed RGStocknet (Relational Graph Stock Enhancing Network) framework is proposed that can boost performance on an arbitrary time series prediction backbone model and carry the potential to incorporate relations with external resources to achieve higher performance further.","2020 International Conference on Pervasive Artificial Intelligence (ICPAI)",2020,"Hung-Yang Li,V. Tseng,Philip S. Yu",1,30,0
"759c72d912504eb4cd17247171c790470bd4f843","https://www.semanticscholar.org/paper/759c72d912504eb4cd17247171c790470bd4f843",2,"Stock Movement Classification from Twitter via Mogrifier Based Memory Cells with Attention Mechanism","Experiment on real-world stock market data shows the Mogrifier based cell can outperform the venerable ones across different market sectors while still achieves lower prediction volatility.","International Conferences on Information Technologies and Electrical Engineering",2020,"Tian Qin",0,38,0
"04fa332bf3a1ed0ffdda71077409ec9eafb19ac0","https://www.semanticscholar.org/paper/04fa332bf3a1ed0ffdda71077409ec9eafb19ac0",2,"ADD: Augmented Disentanglement Distillation Framework for Improving Stock Trend Forecasting","This paper introduces an augmented Disentanglement Distillation approach to remove interferential features from the noised raw data to avoid the two factors disturbing each other's own prediction.","arXiv.org",2020,"H. Tang,Lijun Wu,Weiqing Liu,Jiang Bian",1,35,1
"5cc5beec49fc4059ac18b531678aa3f5e4b9184f","https://www.semanticscholar.org/paper/5cc5beec49fc4059ac18b531678aa3f5e4b9184f",2,"COVID19-HPSMP: COVID-19 adopted Hybrid and Parallel deep information fusion framework for stock price movement prediction","A novel hybrid and parallel DNN-based framework is proposed that integrates different and diversified learning architectures and innovative fusion strategies are used to combine scattered social media news related to COVID-19 with historical mark data.","Expert systems with applications",2021,"Farnoush Ronaghi,Mohammad Salimibeni,F. Naderkhani,Arash Mohammadi",11,55,0
"1eb6d573aadaeadb99325cd01631abb385d30ad3","https://www.semanticscholar.org/paper/1eb6d573aadaeadb99325cd01631abb385d30ad3",2,"REST: Relational Event-driven Stock Trend Forecasting","This paper proposes a relational event-driven stock trend forecasting (REST) framework, which can address the shortcoming of existing methods and construct a stock graph and design a new propagation layer to propagate the effect of event information from related stocks.","The Web Conference",2021,"W. Xu,Weiqing Liu,Chang Xu,Jiang Bian,Jian Yin,Tie-Yan Liu",23,47,2
"05316134c14ed3378bf9f8cb2f91bc6c2b98912c","https://www.semanticscholar.org/paper/05316134c14ed3378bf9f8cb2f91bc6c2b98912c",2,"FinSense: An Assistant System for Financial Journalists and Investors","Given the draft of a financial news story, FinSense extracts the explicit-mentioned stocks and further infers the implicit stocks, providing insightful information for decision making and proposes a novel graph convolutional network model that performs implicit financial instrument inference toward the in-domain data.","Web Search and Data Mining",2021,"Yi-Ting Liou,Chung-Chi Chen,Tsun-Hsien Tang,Hen-Hsen Huang,Hsin-Hsi Chen",8,16,1
"5365a8735a21089f9fb606eeac705292dcd1efca","https://www.semanticscholar.org/paper/5365a8735a21089f9fb606eeac705292dcd1efca",2,"Recurrent dictionary learning for state-space models with an application in stock forecasting","Experimental results show that the proposed RDL method excels over state-of-the-art stock analysis models such as CNN-TA, MFNN, and LSTM and is particularly well suited for stock forecasting.","Neurocomputing",2021,"Shalini Sharma,V. Elvira,É. Chouzenoux,A. Majumdar",8,106,0
"55b0ddacd4e63236332d13b40216453b95d1c99f","https://www.semanticscholar.org/paper/55b0ddacd4e63236332d13b40216453b95d1c99f",2,"A New Strategy for Short-Term Stock Investment Using Bayesian Approach","This paper transforms the daily stock price time series object into a data frame format where the dependent variable is the stock trend label and the independent variables are the stock variations of the last few days and proposes a new method for stock selection and a new stock trading strategy.","Computational Economics",2021,"T. Vo-Van,Ha Che-Ngoc,Nghiep Le-Dai,T. Nguyen-Trang",7,55,0
"63d36bf10b98b5b7f3a42b4ff428a3fa46e47a97","https://www.semanticscholar.org/paper/63d36bf10b98b5b7f3a42b4ff428a3fa46e47a97",2,"A New Strategy for Short-Term Stock Investment Using Bayesian Approach","This paper transforms the daily stock price time series object into a data frame format where the dependent variable is the stock trend label and the independent variables are the stock variations of the last few days and proposes a new method for stock selection and a new stock trading strategy.","Computational Economics",2021,"T. Vo-Van,Ha Che-Ngoc,Nghiep Le-Dai,Thao Nguyen-Trang",0,68,0
"6f235494fe02716bb9eb44c5f69b74c77a5a40b7","https://www.semanticscholar.org/paper/6f235494fe02716bb9eb44c5f69b74c77a5a40b7",2,"Risk-aware Regularization for Opinion-based Portfolio Selection","","International Conference on Web and Social Media",2021,"Ting-Wei Hsu,Chung-Chi Chen,Hen-Hsen Huang,Hsin-Hsi Chen",0,25,0
"b57f1d05b88def6d3949bbbdbfff10a6342cbb70","https://www.semanticscholar.org/paper/b57f1d05b88def6d3949bbbdbfff10a6342cbb70",2,"Learning Multiple Stock Trading Patterns with Temporal Routing Adaptor and Optimal Transport","A novel architecture, Temporal Routing Adaptor (TRA), is proposed to empower existing stock prediction models with the ability to model multiple stock trading patterns and design a learning algorithm based on Optimal Transport to obtain the optimal sample to predictor assignment and effectively optimize the router with such assignment through an auxiliary loss term.","Knowledge Discovery and Data Mining",2021,"Hengxu Lin,Dong Zhou,Weiqing Liu,J. Bian",20,33,5
"f5b6dd1c2dd68cef446ed441f916680f21379a75","https://www.semanticscholar.org/paper/f5b6dd1c2dd68cef446ed441f916680f21379a75",2,"Retrieving Implicit Information for Stock Movement Prediction","A neural network framework that jointly learns with a news selection mechanism to extract implicit information from the chaotic daily news pool and takes advantage of neural representation learning and collaborative filtering to capture the relationship between stocks and news is developed.","Annual International ACM SIGIR Conference on Research and Development in Information Retrieval",2021,"Tsun-Hsien Tang,Chung-Chi Chen,Hen-Hsen Huang,Hsin-Hsi Chen",2,26,0
"227569794c452925d09dcd7a41e96fba23f7460f","https://www.semanticscholar.org/paper/227569794c452925d09dcd7a41e96fba23f7460f",2,"Stock Movement Prediction with Financial News using Contextualized Embedding from BERT","This paper introduces a new text mining method called Fine-Tuned Contextualized-Embedding Recurrent Neural Network (FT-CE-RNN), which uses contextualized vector representations of the headlines (contextualized embeddings) generated from Bidirectional Encoder Representations from Transformers (BERT).","arXiv.org",2021,"Qinkai Chen",11,56,2
"68da277ed4bc7bbd894cb021ac3f9554ee3b2fba","https://www.semanticscholar.org/paper/68da277ed4bc7bbd894cb021ac3f9554ee3b2fba",2,"Quantifying the effects of long-term news on stock markets on the basis of the multikernel Hawkes process","A novel multikernel-powered Hawkes process framework is proposed, which uses multiple kernels to model different time-decaying rates, thus alleviating the instability of the proposed Hawke process based prediction model.","Science China Information Sciences",2021,"Xiao Ding,Jihao Shi,Junwen Duan,Bing Qin,Ting Liu",3,42,0
"9cf526a91b194303a0291b5ef4e83d3bb45f4ae3","https://www.semanticscholar.org/paper/9cf526a91b194303a0291b5ef4e83d3bb45f4ae3",2,"Accurate Multivariate Stock Movement Prediction via Data-Axis Transformer with Multi-Level Contexts","This work proposes DTML (Data-axis Transformer with Multi-Level contexts), a novel approach for stock movement prediction that learns the correlations between stocks in an end-to-end way and achieves the state-of-the-art accuracy on six datasets collected from various stock markets from US, China, Japan, and UK.","Knowledge Discovery and Data Mining",2021,"Jaemin Yoo,Yejun Soun,Yong-chan Park,U. Kang",29,35,5
"f18c3f40f62596337ce79d3d103160d3236498f2","https://www.semanticscholar.org/paper/f18c3f40f62596337ce79d3d103160d3236498f2",2,"Reinforcement Learning for Quantitative Trading","A taxonomy of RL-based QT models is devised, along with a comprehensive summary of the state of the art, and current challenges and proposed future research directions in this exciting field are discussed.","ACM Transactions on Intelligent Systems and Technology",2021,"Shuo Sun,R. Wang,Bo An",10,166,0
"1080516e0a18fa6aab938de5555936ffc6ed815d","https://www.semanticscholar.org/paper/1080516e0a18fa6aab938de5555936ffc6ed815d",2,"SENTiVENT: enabling supervised information extraction of company-specific events in economic and financial news","This work fills a large need for a manually annotated dataset for economic and financial text mining applications and produces a gold-standard dataset annotated with event triggers, participant arguments, event co-reference, and event attributes such as type, subtype, negation, and modality.","Language Resources and Evaluation",2021,"Gilles Jacobs,Veronique Hoste",2,98,1
"b14e764109489f3a19e6823a9c18b8a4fc74339c","https://www.semanticscholar.org/paper/b14e764109489f3a19e6823a9c18b8a4fc74339c",2,"HIST: A Graph-based Framework for Stock Trend Forecasting via Mining Concept-Oriented Shared Information","A novel stock trend forecasting framework that can adequately mine the concept-oriented shared information from predefined concepts and hidden concepts is proposed that can achieve a higher investment return than the baselines.","arXiv.org",2021,"Wentao Xu,Weiqing Liu,Lewen Wang,Yingce Xia,Jiang Bian,Jian Yin,Tie-Yan Liu",13,47,5
"0ebfccfbe6bda90993c1da4c736998b21e1aaf2c","https://www.semanticscholar.org/paper/0ebfccfbe6bda90993c1da4c736998b21e1aaf2c",2,"A review of natural language processing for financial technology","This review first introduces the development of natural language processing, and then summarizes their applications in financial technology, which mainly focuses on public opinion analysis, financial prediction and analysis, risk assessment, intelligent question answering, and automatic document generation.","Other Conferences",2021,"Ruizhuo Gao,Zeqi Zhang,Zhenning Shi,Dan Xu,Weijuan Zhang,Dewei Zhu",4,86,0
"36d767a3969ff388b44dab4717ebefc41629ed54","https://www.semanticscholar.org/paper/36d767a3969ff388b44dab4717ebefc41629ed54",2,"Time horizon-aware modeling of financial texts for stock price prediction","","International Conference on AI in Finance",2021,"Fuli Feng,Xiang Wang,Xiangnan He,Ritchie Ng,Tat-Seng Chua",0,35,0
"d57743b30ca50b1480a72ab41a0564f20f183e92","https://www.semanticscholar.org/paper/d57743b30ca50b1480a72ab41a0564f20f183e92",2,"DeepScalper: A Risk-Aware Reinforcement Learning Framework to Capture Fleeting Intraday Trading Opportunities","DeepScalper is proposed, a deep reinforcement learning framework for intraday trading that significantly outperforms many state-of-the-art baselines in terms of four financial criteria.","International Conference on Information and Knowledge Management",2021,"Shuo Sun,Xu He,R. Wang,Junlei Zhu,Jian Li,Bo An",2,44,0
"8c9ac0b768616aeb4270de59ea50a64166825ec9","https://www.semanticscholar.org/paper/8c9ac0b768616aeb4270de59ea50a64166825ec9",2,"Stock movement prediction via gated recurrent unit network based on reinforcement learning with incorporated attention mechanisms","","Neurocomputing",2022,"Hongfeng Xu,Lei Chai,Zhiming Luo,Shaozi Li",19,45,1
"b1f10c9fbb8dceff45e9c5aa9d7ca925b742d9ac","https://www.semanticscholar.org/paper/b1f10c9fbb8dceff45e9c5aa9d7ca925b742d9ac",2,"NumHTML: Numeric-Oriented Hierarchical Transformer Model for Multi-task Financial Forecasting","A numeric-oriented hierarchical transformer model (NumHTML) to predict stock returns, and financial risk using multi-modal aligned earnings calls data by taking advantage of the different categories of numbers and their magnitude.","AAAI Conference on Artificial Intelligence",2022,"Linyi Yang,Jiazheng Li,Ruihai Dong,Yue Zhang,B. Smyth",6,49,1
"12bec536405f7839fe4116aa529535e6a660232b","https://www.semanticscholar.org/paper/12bec536405f7839fe4116aa529535e6a660232b",2,"An Exploratory Study of Stock Price Movements from Earnings Calls","","The Web Conference",2022,"Sourav Medya,Mohammad Rasoolinejad,Yang Yang,B. Uzzi",5,37,0
"8ee409aa3573a78f1b3783086736f8bfc8985328","https://www.semanticscholar.org/paper/8ee409aa3573a78f1b3783086736f8bfc8985328",2,"GCNET: graph-based prediction of stock price movement using graph convolutional network","A novel framework, called GCNET, is introduced that models the relations among an arbitrary set of stocks as a graph structure called influence network and uses a set of history-based prediction models to infer plausible initial labels for a subset of the stock nodes in the graph.","Engineering applications of artificial intelligence",2022,"Alireza Jafari,Saman Haratizadeh",4,54,0
"fa118351f9088723499d89cc754c1caea4be16d2","https://www.semanticscholar.org/paper/fa118351f9088723499d89cc754c1caea4be16d2",2,"Twitter-aided decision making: a review of recent developments","This review examines 28 newer papers published in last five years that continued to advance Twitter-aided decision making, and offers a methodological analysis that considers four aspects of methods used in these papers, including problem formulation, solution, Twitter feature, and information transformation.","Applied intelligence (Boston)",2022,"Yihong Zhang,Masumi Shirakawa,Yuanyuan Wang,Zhi Li,Takahiro Hara",1,113,0
"a9a3ca9243c2236ffd2213e479265e54feb9e5a8","https://www.semanticscholar.org/paper/a9a3ca9243c2236ffd2213e479265e54feb9e5a8",2,"Incorporating Transformers and Attention Networks for Stock Movement Prediction","A transformer-based attention network framework that uses historical text and stock prices to capture the temporal dependence of financial data to achieve an accurate prediction of stock movements is proposed.","Complex",2022,"Ya-wei Li,Shuqi Lv,Xinghua Liu,Qiuyue Zhang",3,23,0
"8393abd9eb158828e11287dbb650dd9dd55163d8","https://www.semanticscholar.org/paper/8393abd9eb158828e11287dbb650dd9dd55163d8",2,"Inductive Representation Learning on Dynamic Stock Co-Movement Graphs for Stock Predictions",,"INFORMS journal on computing",2022,"Hu Tian,Xiaolong Zheng,Kang Zhao,Maggie Wenjing Liu,D. Zeng",1,59,0
"94c16301ead96a479d5975bd8b1dbde65db017c8","https://www.semanticscholar.org/paper/94c16301ead96a479d5975bd8b1dbde65db017c8",2,"Stock portfolio selection balancing variance and tail risk via stock vector representation acquired from price data and texts","","Knowledge-Based Systems",2022,"Xin Du,Kumiko Tanaka-Ishii",1,28,0
"8f4b712f21bc4e1f65a89f8ae5b6a379fb4fa4af","https://www.semanticscholar.org/paper/8f4b712f21bc4e1f65a89f8ae5b6a379fb4fa4af",2,"Transformer-based attention network for stock movement prediction","","Expert systems with applications",2022,"Qiuyue Zhang,Chao Qin,Yunfeng Zhang,Fangxun Bao,Caiming Zhang,Peide Liu",18,43,2
"5e6748c98bfa7609a97315cf9eb0361111ec80ab","https://www.semanticscholar.org/paper/5e6748c98bfa7609a97315cf9eb0361111ec80ab",2,"A self-regulated generative adversarial network for stock price movement prediction based on the historical price and tweets","","Knowledge-Based Systems",2022,"Hongfeng Xu,Donglin Cao,Shaozi Li",5,50,0
"63ae3fe9144f9f54cfbe0caf74c1040c05cb5c72","https://www.semanticscholar.org/paper/63ae3fe9144f9f54cfbe0caf74c1040c05cb5c72",2,"Read the News, Not the Books: Forecasting Firms’ Long-term Financial Performance via Deep Text Mining","Textual data from firm-related events in news articles can effectively predict various firm financial ratios, with or without historical financial ratio, and news-powered deep learning models are shown to outperform standard econometric models operating on precise accounting historical data.","ACM Transactions on Management Information Systems",2022,"Shuang (Sophie) Zhai,Zhu Zhang",1,78,0
"8b4ea38f844a2e5b18d296cce6779354fe651a28","https://www.semanticscholar.org/paper/8b4ea38f844a2e5b18d296cce6779354fe651a28",2,"Astock: A New Dataset and Automated Stock Trading based on Stock-specific News Analyzing Model","A platform to study the NLP-aided stock auto-trading algorithms systematically and proposes a self-supervised learning strategy based on SRLP to enhance the out-of-distribution generalization performance of the system.","FINNLP",2022,"Jinan Zou,Hai Cao,Lingqiao Liu,Yuhao Lin,Ehsan Abbasnejad,Javen Qinfeng Shi",5,22,0
"b7fc2f1d9caf20e1e213f7032ac29e965b3ec063","https://www.semanticscholar.org/paper/b7fc2f1d9caf20e1e213f7032ac29e965b3ec063",2,"FactorVAE: A Probabilistic Dynamic Factor Model Based on Variational Autoencoder for Predicting Cross-Sectional Stock Returns","This paper proposes a novel factor model, FactorVAE, as a probabilistic model with inherent randomness for noise modeling, and proposes a prior-posterior learning method based on VAE, which can effectively guide the learning of model by approximating an optimal posterior factor model with future information.","AAAI Conference on Artificial Intelligence",2022,"Yitong Duan,Lei Wang,Qizhong Zhang,Jian Li",7,33,1
"864f044560bcd544bbbcaa702e91e93b88e91cec","https://www.semanticscholar.org/paper/864f044560bcd544bbbcaa702e91e93b88e91cec",2,"Instance-based deep transfer learning with attention for stock movement prediction","Experimental results reveal that the proposed novel instance-based deep transfer learning models with attention mechanism significantly improve the performance of deep learning models when limited training data are available.","Applied intelligence (Boston)",2022,"Qi-Qiao He,S. W. I. Siu,Yain-Whar Si",5,38,0
"82f4b73220a0eef1d182fc94bdcb4ad7a8874c14","https://www.semanticscholar.org/paper/82f4b73220a0eef1d182fc94bdcb4ad7a8874c14",2,"Evaluating Impact of Social Media Posts by Executives on Stock Prices","This paper investigates the impact of social media posts on close price prediction of stocks using Twitter and Reddit posts and shows improvements in prediction on including social media data and greater improvements on including executive posts.","Fire",2022,"Anubhav Sarkar,Swagata Chakraborty,Sohom Ghosh,Sudipta Naskar",0,36,0
"a5785ee0f2efbafd0b89e388c7b6538f48deafd5","https://www.semanticscholar.org/paper/a5785ee0f2efbafd0b89e388c7b6538f48deafd5",2,"FinTech for Social Good: A Research Agenda from NLP Perspective","","arXiv.org",2022,"Chung-Chi Chen,Hiroya Takamura,Hsin-Hsi Chen",2,34,0
