"id","url","score","title","summary","venue","year","authors","citationCount","referenceCount","influentialCitationCount"
"0c9da04f9be18d4706e02f2aece28a33fcbec006","https://www.semanticscholar.org/paper/0c9da04f9be18d4706e02f2aece28a33fcbec006",1,"Construction of Financial News Sentiment Indices Using Deep Neural Networks","A deep neural network model that combines CNN, Att-BLSTM and BERT for predicting financial news sentiment polarity is designed and it is shown that the news sentiment exhibits a significant relationship with stock market returns.","Social Science Research Network",2019,"Shaokai Wang,Zili Zhang",1,25,1
"ce0ee83d521874a791681bc3b22fa09a02d33e4f","https://www.semanticscholar.org/paper/ce0ee83d521874a791681bc3b22fa09a02d33e4f",1,"A new metric for individual stock trend prediction","It is suggested that MPR is a more effective metric than the classification metrics in stock trend prediction, which is measured based on the correlation between the metric value and profit of the model.","Engineering applications of artificial intelligence",2019,"Guang Liu,Xiaojie Wang",27,52,4
"5d6ddfd557f193f3848f87ec0068156cd82a0054","https://www.semanticscholar.org/paper/5d6ddfd557f193f3848f87ec0068156cd82a0054",1,"Deep learning in exchange markets","Although the LSTM is more suitable for multivariate time series analysis from a theoretical point of view, test results indicate that the CNN has on average the best predictive power in the case study under analysis, which is the UK to Win Horse Racing market during pre-live stage in the world’s most relevant betting exchange.","Information Economics and Policy",2019,"Rui Gonçalves,V. Ribeiro,F. L. Pereira,A. Rocha",17,23,1
"124b441acc6b83dd12e4d7e70356306f8af2fb95","https://www.semanticscholar.org/paper/124b441acc6b83dd12e4d7e70356306f8af2fb95",1,"Optimistic Bull or Pessimistic Bear: Adaptive Deep Reinforcement Learning for Stock Portfolio Allocation","A novel Adaptive Deep Deterministic Reinforcement Learning scheme (Adaptive DDPG) is proposed for the portfolio allocation task, which incorporates optimistic or pessimistic deep reinforcement learning that is reflected in the influence from prediction errors.","",2019,"Xinyi Li,Yinchuan Li,Y. Zhan,Xiao-Yang Liu",26,23,4
"5cea917487df6f1ce067bec45b4d14d7f30ff72b","https://www.semanticscholar.org/paper/5cea917487df6f1ce067bec45b4d14d7f30ff72b",1,"EAN: Event Attention Network for Stock Price Trend Prediction based on Sentimental Embedding","An event attention network (EAN) is proposed to exploit sentimental event-embedding for stock price trend prediction and shows that this model performs significantly better in terms of short-term stock trend prediction.","Web Science Conference",2019,"Yaowei Wang,Qing Li,J. Huang,Mark Junjie Li",10,27,2
"f2f065004001a1ac2f58e554bfe3f942b9e825dd","https://www.semanticscholar.org/paper/f2f065004001a1ac2f58e554bfe3f942b9e825dd",1,"LSTM with Wavelet Transform Based Data Preprocessing for Stock Price Prediction","A new multioptimal combination wavelet transform (MOCWT) method with a novel threshold-denoising function is presented to reduce the degree of distortion in signal reconstruction, and experimental results clearly showed that the proposed MOCWT outperforms the traditional methods in the term of prediction accuracy.","Mathematical Problems in Engineering",2019,"Xiaodan Liang,Zhaodi Ge,Liling Sun,Maowei He,Hanning Chen",37,21,4
"8978e4c542e7a96d087cdf30549509db3647af81","https://www.semanticscholar.org/paper/8978e4c542e7a96d087cdf30549509db3647af81",1,"AlphaStock","","Proceedings of the 25th ACM SIGKDD International Conference on Knowledge Discovery & Data Mining",2019,"Jingyuan Wang,Yang Zhang,K. Tang,Junjie Wu,Zhang Xiong",5,21,0
"c17c6dfde11b6da20f607be0ea46d342ff2e3fa1","https://www.semanticscholar.org/paper/c17c6dfde11b6da20f607be0ea46d342ff2e3fa1",1,"Developing an Risk Signal Detection System Based on Opinion Mining for Financial Decision Support","","Sustainability",2019,"B. Yoon,Taeyeoun Roh,Hyejin Jang,Dooseob Yun",2,45,0
"5e9cc4ae57264d7628afdf7c5fe0b534a325a762","https://www.semanticscholar.org/paper/5e9cc4ae57264d7628afdf7c5fe0b534a325a762",1,"Weibo vs Wall Street Journal: How are Social & Mass Media Different in the Stock Market?","","Social Science Research Network",2019,"Hang Dong,Jie Ren,B. Padmanabhan,J. Nickerson",1,64,0
"694968308ca99780d55bc09b594f7fbfecd3d2de","https://www.semanticscholar.org/paper/694968308ca99780d55bc09b594f7fbfecd3d2de",1,"How does social media sentiment impact mass media sentiment? A study of news in the financial markets","Using data from Sina Weibo and Sina Finance, it is shown that social media does influence mass media sentiment emergence for financial news and the sentiment consistency between social media reaction and prior news articles amplifies the persistence ofmass media sentiment over time.","J. Assoc. Inf. Sci. Technol.",2019,"Jie Ren,Hang Dong,B. Padmanabhan,J. Nickerson",13,49,1
"11a6ebfff1daf87e24a30de53e1863fe82b70b97","https://www.semanticscholar.org/paper/11a6ebfff1daf87e24a30de53e1863fe82b70b97",1,"A Deep Learning Framework for Pricing Financial Instruments","An integrated deep learning architecture for the stock movement prediction that simultaneously leverages all available alpha sources and designs a graph-based component that extracts cross-sectional interactions which circumvents usage of SVD that's needed in standard models.","arXiv.org",2019,"Qiong Wu,Zheng Zhang,A. Pizzoferrato,Mihai Cucuringu,Zhenming Liu",9,55,0
"c185caa7e0daff41cfb0cf3a10e5ae4b47163f71","https://www.semanticscholar.org/paper/c185caa7e0daff41cfb0cf3a10e5ae4b47163f71",1,"Equity2Vec: end-to-end deep learning framework for cross-sectional asset pricing","This work proposes an end-to-end deep learning framework to price assets that simultaneously leverages all the available heterogeneous alpha sources including technical indicators, financial news signals, and cross-sectional signals and monetizes the signals effectively.","International Conference on AI in Finance",2019,"Qiong Wu,Christopher G. Brinton,Zhenghao Zhang,A. Pizzoferrato,Zhenming Liu,Mihai Cucuringu",9,82,1
"2efc519bd3fcb8a31202e65b85b4c0a9f3b1903d","https://www.semanticscholar.org/paper/2efc519bd3fcb8a31202e65b85b4c0a9f3b1903d",1,"Stock closing price prediction based on sentiment analysis and LSTM","It is confirmed that investors’ emotional tendency is effective to improve the predicted results; the introduction of EMD can improve the predictability of inventory sequences; and the attention mechanism can help LSTM to efficiently extract specific information and current mission objectives from the information ocean.","Neural computing & applications (Print)",2019,"Zhigang Jin,Yang Yang,Yuhong Liu",141,45,7
"28a49bea48fdd9e95d921ec2c25c7b17e196e2a5","https://www.semanticscholar.org/paper/28a49bea48fdd9e95d921ec2c25c7b17e196e2a5",1,"Exploring Graph Neural Networks for Stock Market Predictions with Rolling Window Analysis","This paper investigates the effectiveness of work at the intersection of market predictions and graph neural networks, which hold the potential to mimic the ways in which investors make decisions by incorporating company knowledge graphs directly into the predictive model.","arXiv.org",2019,"Daiki Matsunaga,T. Suzumura,Toshihiro Takahashi",52,19,4
"d677c8e17fd7057bab7c6830ce85a7fd4995cabc","https://www.semanticscholar.org/paper/d677c8e17fd7057bab7c6830ce85a7fd4995cabc",1,"WATTNet: Learning to Trade FX via Hierarchical Spatio-Temporal Representation of Highly Multivariate Time Series","WaveATTentionNet (WATTNet) is introduced, a novel temporal convolution (TCN) model for spatio-temporal modeling of highly multivariate time series and validated it across NDF markets with varying degrees of dissimilarity between the training and test periods in terms of volatility and general market regimes.","Proceedings of the Twenty-Ninth International Joint Conference on Artificial Intelligence",2019,"Michael Poli,Jinkyoo Park,Ilija Ilievski",8,29,0
"e5d17d6ec61c72471002e74a0b219f3cddd41059","https://www.semanticscholar.org/paper/e5d17d6ec61c72471002e74a0b219f3cddd41059",1,"News2vec: News Network Embedding with Subnode Information","The News2vec model is proposed to allow the distributed representation of news taking into account its associated features, and offers an easy solution to create embeddings for unseen news nodes based on its attributes.","Conference on Empirical Methods in Natural Language Processing",2019,"Ye Ma,Lu Zong,Yikang Yang,Jionglong Su",17,25,0
"dc20cbb92ee0b9dac0153ad764fe1a3b0aea9b58","https://www.semanticscholar.org/paper/dc20cbb92ee0b9dac0153ad764fe1a3b0aea9b58",1,"An integrated early warning system for stock market turbulence","The proposed EWS first classifies stock market crises according to an indicator function with thresholds dynamically selected by the two-peak method, then a hybrid algorithm is developed in the framework of a long short-term memory network to make daily predictions that alert turmoils.","Expert systems with applications",2019,"Peiwan Wang,Lu Zong,Ye Ma",27,106,1
"1fffab513a3aecfb1d5f3e03c3d489e45d848584","https://www.semanticscholar.org/paper/1fffab513a3aecfb1d5f3e03c3d489e45d848584",1,"Financial Time Series Forecasting with Deep Learning : A Systematic Literature Review: 2005-2019","A comprehensive literature review on DL studies for financial time series forecasting implementations and grouped them based on their DL model choices, such as Convolutional Neural Networks (CNNs), Deep Belief Networks (DBNs), Long-Short Term Memory (LSTM).","Applied Soft Computing",2019,"Omer Berat Sezer,M. U. Gudelek,A. Ozbayoglu",445,234,11
"d05d1ad2f87f8a0c3fcc8cdd43726e78ed5268d0","https://www.semanticscholar.org/paper/d05d1ad2f87f8a0c3fcc8cdd43726e78ed5268d0",1,"Deep Learning for Financial Applications : A Survey","This paper tried to provide a state-of-the-art snapshot of the developed DL models for financial applications, as of today, and categorized the works according to their intended subfield in finance but also analyzed them based on their DL models.","Applied Soft Computing",2020,"A. Ozbayoglu,M. U. Gudelek,Omer Berat Sezer",186,207,7
"2fb49d09c830976d99648cc2b4b94db221ff7633","https://www.semanticscholar.org/paper/2fb49d09c830976d99648cc2b4b94db221ff7633",1,"News Headlines Categorization Scheme for Unlabelled Data","A news categorization scheme is proposed to filter out and categorize news headlines related to Pakistan Stock Exchange (PSX) using negligible manual effort and natural language processing based technique is used to extract context of seed keyword from initially filtered news headlines.","2020 International Conference on Emerging Trends in Smart Technologies (ICETST)",2020,"Shazia Usmani,J. Shamsi",6,16,0
"6a029b5a086708bc8787e993fb98184a6ff9f08b","https://www.semanticscholar.org/paper/6a029b5a086708bc8787e993fb98184a6ff9f08b",1,"An Adaptive Master-Slave Regularized Model for Unexpected Revenue Prediction Enhanced with Alternative Data","This paper proposed an adaptive master-slave regularized model, called AMS, to effectively leverage alternative data for unexpected revenue prediction and has demonstrated the effectiveness of the model against a set of competitors.","IEEE International Conference on Data Engineering",2020,"Jin Xu,Jingbo Zhou,Yongpo Jia,Jian Li,Hui Xiong",9,43,0
"d826a309d16e0564c9cf9b3ed91bd9ff28f7a0d6","https://www.semanticscholar.org/paper/d826a309d16e0564c9cf9b3ed91bd9ff28f7a0d6",1,"Incorporating Expert-Based Investment Opinion Signals in Stock Prediction: A Deep Learning Framework","A novel framework which includes a stance detection model named MFN, which learns the representation of each review by integrating multi-view textual features and extended knowledge in financial domain to distill bullish/bearish investment opinions, and can effectively improve the performance of both investment opinion mining and individual stock forecasting.","AAAI Conference on Artificial Intelligence",2020,"Heyuan Wang,Tengjiao Wang,Yi Li",24,35,1
"04dd0664a96b183ef886700983463819fd218397","https://www.semanticscholar.org/paper/04dd0664a96b183ef886700983463819fd218397",1,"On the predictability of U.S. stock market using machine learning and deep learning techniques","The techniques are proven to be robust both statistically and economically when forecasting the equity premium out-of-sample using recursive window method and overall, the deep learning techniques produced the best result in this thesis.","",2020,"Jonathan Iworiso",0,227,0
"568c9bdbb331885f4ecc788cd3e577d80923cc1a","https://www.semanticscholar.org/paper/568c9bdbb331885f4ecc788cd3e577d80923cc1a",1,"Electronic word-of-mouth effects on studio performance leveraging attention-based model","","Neural computing & applications (Print)",2020,"Yang Liu,Hao Fei,Qingguo Zeng,Bobo Li,Lili Ma,Donghong Ji,Joaquín B. Ordieres Meré",0,73,0
"e343ad825a1dddd1fad82d733eeada3aa781ff6c","https://www.semanticscholar.org/paper/e343ad825a1dddd1fad82d733eeada3aa781ff6c",1,"Electronic word-of-mouth effects on studio performance leveraging attention-based model","This study proves that deep learning with the attention mechanism has the best accuracy in both eWOM and stock price movement and presents both a hierarchical two-layer attention network and hierarchical convoluted attention network (HCAN), which quantify the importance of crucial eWom features in capturing valuable information from audience members’ reviews.","Neural computing & applications (Print)",2020,"Yang Liu,Hao Fei,Qingguo Zeng,Bobo Li,Lili Ma,Donghong Ji,Joaquín B. Ordieres Meré",2,68,0
"388b735b1089d5c9877107c70f6e939986eee9e6","https://www.semanticscholar.org/paper/388b735b1089d5c9877107c70f6e939986eee9e6",1,"Feature Transformation and Simulation of Short Term Price Variability in Reinforcement Learning for Portfolio Management","Two automatic feature transformation techniques - Bayesian recurrent neural network (BRNN) and GANs for modelling short-term realistic price variability are able to improve the performance of reinforcement learning agents in solving portfolio management problem effectively, when measured in terms of increasing profitability and reducing risks.","Spring Simulation Multiconference",2020,"Yen-Chih Lin,Jeremy Blum",0,16,0
"909c10bcabccc86aa19866734305a28f42962b2e","https://www.semanticscholar.org/paper/909c10bcabccc86aa19866734305a28f42962b2e",1,"ESG2Risk: A Deep Learning Framework from ESG News to Stock Volatility Prediction","Experimental evaluation of the proposed pipeline of ESG news extraction, news representations, and Bayesian inference of deep learning models demonstrates the superior predicting performance as well as the relation of high volatility prediction to stocks with potential high risk and low return.","arXiv.org",2020,"Tian Guo,N. Jamet,Valentin Betrix,Louis-Alexandre Piquet,E. Hauptmann",14,19,1
"f5e54f84dcf68583d64d3166808cfbd9da745342","https://www.semanticscholar.org/paper/f5e54f84dcf68583d64d3166808cfbd9da745342",1,"A Novel Distributed Representation of News (DRNews) for Stock Market Predictions","The attention mechanism suggests that short-term stock trend and stock market crises both receive influences from daily news with the former demonstrates more critical responses on the information related to the stock market, whilst the latter draws more concerns on the banking sector and economic policies.","arXiv.org",2020,"Ye Ma,Lu Zong,Peiwan Wang",5,47,1
"01d1844ed2b8ea2aa4e88fc69b414bfbd95fc2d6","https://www.semanticscholar.org/paper/01d1844ed2b8ea2aa4e88fc69b414bfbd95fc2d6",1,"Research on Stock Prediction Model Based on Deep Learning","The L STM model with Encoder-Decoder mode and a hybridized framework of LSTM with CNN are built to improve the original model and establish a quantitative model with higher prediction accuracy.","Journal of Physics: Conference Series",2020,"Haiying Zhang,Qiaomei Liang,Siheng Li,Rongqi Wang,Qingqiang Wu",1,11,0
"c825d1526a21e002e21fc1d1082839f4ae98b4e9","https://www.semanticscholar.org/paper/c825d1526a21e002e21fc1d1082839f4ae98b4e9",1,"A hybrid two-stage financial stock forecasting algorithm based on clustering and ensemble learning","A hybrid prediction model, which combines both the k-means clustering and ensemble learning, has been proposed, and the experimental results demonstrate that the hybrid Prediction model obtains the best predicting accuracy of the stock price.","Applied intelligence (Boston)",2020,"Ying Xu,Cuijuan Yang,Shaoliang Peng,Y. Nojima",31,35,1
"5cff9257bca8d75ed3f6153d6e744a2c483dfdb1","https://www.semanticscholar.org/paper/5cff9257bca8d75ed3f6153d6e744a2c483dfdb1",1,"Dancing with Trump in the Stock Market","This article has found that the echoing reinforced effect of financial news with Trump’s market-related tweets can influence the market movement and proposes a deep information echoing model to predict the hourly stock market trend, such as the rise and fall of the Dow Jones Industrial Average.","ACM Transactions on Intelligent Systems and Technology",2020,"Kun Yuan,Guannan Liu,Junjie Wu,Hui Xiong",7,42,0
"a70a860d76ce108eedf7fc86a8bdc5a2d2f1e1d4","https://www.semanticscholar.org/paper/a70a860d76ce108eedf7fc86a8bdc5a2d2f1e1d4",1,"Temporally Correlated Task Scheduling for Sequence Learning","A learnable scheduler to sequence learning is introduced, which can adaptively select auxiliary tasks for training depending on the model status and the current training data, and significantly improves the performance of simultaneous machine translation and stock trend forecasting.","International Conference on Machine Learning",2020,"Xueqing Wu,Lewen Wang,Yingce Xia,Weiqing Liu,Lijun Wu,Shufang Xie,Tao Qin,Tie-Yan Liu",7,53,0
"d5aaa87a737c4ff98e0955b951b9892d03d221af","https://www.semanticscholar.org/paper/d5aaa87a737c4ff98e0955b951b9892d03d221af",1,"A novel ensemble deep learning model for stock prediction based on stock prices and news","The purpose of this work is to explain the design philosophy and show that ensemble deep learning technologies can truly predict future stock price trends more effectively and can better assist investors in making the right investment decision than other traditional methods.","International Journal of Data Science and Analysis",2020,"Yang Li,Yi Pan",42,29,0
"74432c42737b03963e135297cb68f62c32510acc","https://www.semanticscholar.org/paper/74432c42737b03963e135297cb68f62c32510acc",1,"Multistep-Ahead Stock Price Forecasting Based on Secondary Decomposition Technique and Extreme Learning Machine Optimized by the Differential Evolution Algorithm","The empirical results show that the hybrid model proposed in this paper achieves the best prediction performance in all prediction scenarios, which indicates that the modeling idea focusing on the residual term effectively improves the prediction performance of the model.","",2020,"Zhenpeng Tang,Tingting Zhang,Junchuan Wu,Xiaoxu Du,Kaijie Chen",7,60,0
"3e64604b2688a59b43eefb463ef4b7deaa6b814b","https://www.semanticscholar.org/paper/3e64604b2688a59b43eefb463ef4b7deaa6b814b",1,"DEEP LEARING APLICADO À NEGOCIAÇÃO DE AÇÕES POR ALGORITMOS: UMA REVISÃO DESCRITIVA DA LITERATURA","","",2020,"Camilo Ilzo Shimabukuro,Napoleão Verardi Galegale,M. Okano,Celi Langhi",0,55,0
"917f11d187198a8835dcba28c0b69e3c9c53cafd","https://www.semanticscholar.org/paper/917f11d187198a8835dcba28c0b69e3c9c53cafd",1,"Stock movement predictive network via incorporative attention mechanisms based on tweet and historical prices","The core innovation is that the incorporative attention combines local and contextual attention mechanisms to clean the contextual embeddings by using local semantics, which effectively reduce the noises in the constructed higher-level representations and enhance the performance.","Neurocomputing",2020,"Hongfeng Xu,Lei Chai,Zhiming Luo,Shaozi Li",11,38,1
"7b66f8db326abbdc91d29f99d63b512b9b2327c9","https://www.semanticscholar.org/paper/7b66f8db326abbdc91d29f99d63b512b9b2327c9",1,"RGBSticks : A New Deep Learning Based Framework for Stock Market Analysis and Prediction","A novel intuitive graphical representation for daily stock prices is presented, which is referred as RGBSticks, a variation of classical candle sticks, which allows the usage of complex deep learning based techniques to produce insightful visualizations for market’s past and future states.","",2020,"E. Unlu",1,18,0
"915e63d33c9ea503f06a13669a1a185910e417da","https://www.semanticscholar.org/paper/915e63d33c9ea503f06a13669a1a185910e417da",1,"Incorporating stock prices and news sentiments for stock market prediction: A case of Hong Kong","This paper builds up a stock prediction system and proposes an approach that represents numerical price data by technical indicators via technical analysis, and represents textual news articles by sentiment vectors via sentiment analysis, which outperforms the baselines in both validation and test sets using two different evaluation metrics.","Information Processing & Management",2020,"Xiaodong Li,Pangjing Wu,Wenpeng Wang",134,55,4
"ebc294e5c77bc345f9f31f45ada11abe381102fb","https://www.semanticscholar.org/paper/ebc294e5c77bc345f9f31f45ada11abe381102fb",1,"Stock Price Prediction Using BERT and Word2Vec Sentiment Analysis","This paper experiments with machine learning algorithm and twitter sentiment analysis to predict future stock market prices with results that compare Word2vec and BERT and apply those method in predicting future stock price.","International Journal of Emerging Trends in Engineering Research",2020,"Willem Sebastian,S. M. Isa",1,22,0
"21df4f8a8c114e886bd49a6d53c8f9a3f2ca3deb","https://www.semanticscholar.org/paper/21df4f8a8c114e886bd49a6d53c8f9a3f2ca3deb",1,"Using Machine Learning and Alternative Data to Predict Movements in Market Risk","It is shown that movements in market implied volatility can indeed be predicted through the help of machine learning techniques, and preliminary evidence of non-linear relationships between features obtained from Wikipedia page traffic and movements inMarket implied volatility is revealed.","",2020,"T. Dierckx,Jesse Davis,W. Schoutens",2,67,0
"a95d54030c02fd0d8a127e7cad4dfe989284f665","https://www.semanticscholar.org/paper/a95d54030c02fd0d8a127e7cad4dfe989284f665",1,"Analyzing News Sentiments and their Impact on Stock Market Trends using POS and TF-IDF based approach","A new method in interpreting the sentiment of a given news through a fine-grained analysis of syntactic sentence patterns using different Part of Speech (POS) combinations is proposed, which is compatible with current researches stating about existing correlation between financial news and stock prices.","International Conference on Artificial Intelligence in Engineering and Technology",2020,"Sonam,M. Devaraj",3,17,0
"83b86e34daa2dedbe93576c055dcde1ccfcad16a","https://www.semanticscholar.org/paper/83b86e34daa2dedbe93576c055dcde1ccfcad16a",1,"Where Does Trust Break Down? A Quantitative Trust Analysis of Deep Neural Networks via Trust Matrix and Conditional Trust Densities","This work introduces the concept of trust matrix, a novel trust quantification strategy that leverages the recently introduced question-answer trust metric by Wong et al. to provide deeper, more detailed insights into where trust breaks down for a given deep neural network given a set of questions.","arXiv.org",2020,"Andrew Hryniowski,Xiao Yu Wang,A. Wong",7,23,0
"9865a297f9be143081a95f8af9881ca2c8fab034","https://www.semanticscholar.org/paper/9865a297f9be143081a95f8af9881ca2c8fab034",1,"MAEC","","Proceedings of the 29th ACM International Conference on Information & Knowledge Management",2020,"Jiazhen Li,Linyi Yang,Barry Smyth,Ruihai Dong",0,20,0
"0ca7033ef57ebb3df51a229bd81d15efe3341382","https://www.semanticscholar.org/paper/0ca7033ef57ebb3df51a229bd81d15efe3341382",1,"MAEC: A Multimodal Aligned Earnings Conference Call Dataset for Financial Risk Prediction","A new, large-scale multi-modal, text-audio paired, earnings-call dataset named MAEC, based on S&P 1500 companies is introduced, more than six times larger than those currently available to the research community.","International Conference on Information and Knowledge Management",2020,"Jiazheng Li,Linyi Yang,Barry Smyth,Ruihai Dong",24,31,0
"6f8f97bf6caa13682230560fee2d86b9b4d509a5","https://www.semanticscholar.org/paper/6f8f97bf6caa13682230560fee2d86b9b4d509a5",1,"Analysis of financial market trend based on autoregressive conditional heteroscedastic model and BP neural network prediction","The research shows that the BP neural network model established by using the lag variable of the Web text sentiment index as the input layer variable is more reliable and can be widely used in the stock market.","Journal of Intelligent & Fuzzy Systems",2020,"Xin Zhang",5,23,0
"3e8b49ec2330368b754e4f8b47e8aeb0f966d78b","https://www.semanticscholar.org/paper/3e8b49ec2330368b754e4f8b47e8aeb0f966d78b",1,"Event-Driven Learning of Systematic Behaviours in Stock Markets","This work proposes a pipeline that achieves significantly better accuracies and higher simulated annualized returns than state-of-the-art models when being applied to predicting Standard&Poor 500, Dow Jones, Nasdaq indices and 10 individual stocks.","Findings",2020,"Xianchao Wu",4,31,0
"e7e333042383c41b4f2d86d362fcc15d25261d57","https://www.semanticscholar.org/paper/e7e333042383c41b4f2d86d362fcc15d25261d57",1,"VolTAGE: Volatility Forecasting via Text-Audio Fusion with Graph Convolution Networks for Earnings Calls","This work introduces a neural model for stock volatility prediction that accounts for stock interdependence via graph convolutions while fusing verbal, vocal, and financial features in a semi-supervised multi-task risk forecasting formulation.","Conference on Empirical Methods in Natural Language Processing",2020,"Ramit Sawhney,Piyush Khanna,Arshiya Aggarwal,Taru Jain,Puneet Mathur,R. Shah",13,64,1
